id,username,user_preferences,contact_number,user_bio,email_sensitive,full_name_sensitive,phone_number_sensitive,ssn_sensitive
276,cguerro7n,[],934-789-1384,Maecenas rhoncus aliquam lacus.,cguerro7n@adobe.com,Curr Guerro,731-723-8352,525-87-8142
277,erippingale7o,[],639-299-5279,"Morbi ut odio. Cras mi pede, malesuada in, imperdiet et, commodo vulputate, justo. In blandit ultrices enim.",erippingale7o@vkontakte.ru,Emily Rippingale,875-664-3704,636-57-7404
278,clukas7p,"[{},{},{}]",474-159-9141,Praesent lectus.,clukas7p@nhs.uk,Coreen Lukas,500-475-3003,592-05-1200
279,skuschek7q,[],645-333-9984,Phasellus id sapien in sapien iaculis congue.,skuschek7q@vistaprint.com,Son Kuschek,822-243-9867,861-72-0211
280,boverel7r,[{}],567-107-7373,"Cras pellentesque volutpat dui. Maecenas tristique, est et tempus semper, est quam pharetra magna, ac consequat metus sapien ut nunc.",boverel7r@github.io,Benoit Overel,214-127-6739,816-57-4132
281,draithbie7s,[{}],840-400-7377,Duis aliquam convallis nunc. Proin at turpis a pede posuere nonummy.,draithbie7s@smugmug.com,Dee Raithbie,545-990-7264,173-98-8297
282,gbrosnan7t,"[{},{}]",225-967-2037,Mauris lacinia sapien quis libero. Nullam sit amet turpis elementum ligula vehicula consequat.,gbrosnan7t@digg.com,Ginny Brosnan,966-193-6205,356-06-3751
283,yjacques7u,[],967-267-5782,Nullam sit amet turpis elementum ligula vehicula consequat. Morbi a ipsum.,yjacques7u@skyrock.com,Yettie Jacques,690-214-1167,668-37-3024
284,clineker7v,"[{},{}]",659-390-2823,"Mauris ullamcorper purus sit amet nulla. Quisque arcu libero, rutrum ac, lobortis vel, dapibus at, diam. Nam tristique tortor eu pede.",clineker7v@1688.com,Curry Lineker,526-519-1695,314-90-9510
285,sprobet7w,"[{},{}]",760-990-3827,Maecenas ut massa quis augue luctus tincidunt.,sprobet7w@webnode.com,Sunny Probet,476-818-2025,766-34-8603
286,elaville7x,[{}],778-378-5314,"Cum sociis natoque penatibus et magnis dis parturient montes, nascetur ridiculus mus. Etiam vel augue. Vestibulum rutrum rutrum neque.",elaville7x@huffingtonpost.com,Elnore Laville,523-562-0932,830-06-1119
287,sdubbin7y,[{}],949-207-4720,Sed ante. Vivamus tortor. Duis mattis egestas metus.,sdubbin7y@wsj.com,See Dubbin,296-976-1816,891-52-7581
288,kmarriot7z,"[{},{},{},{},{}]",966-119-7793,Morbi a ipsum.,kmarriot7z@independent.co.uk,Ky Marriot,746-287-1036,835-14-0281
289,kkensett80,[],701-836-7849,"Nullam orci pede, venenatis non, sodales sed, tincidunt eu, felis. Fusce posuere felis sed lacus. Morbi sem mauris, laoreet ut, rhoncus aliquet, pulvinar sed, nisl.",kkensett80@gnu.org,Kurtis Kensett,281-428-9898,531-37-3625
290,pwhithalgh81,[{}],966-390-7141,"Duis ac nibh. Fusce lacus purus, aliquet at, feugiat non, pretium quis, lectus. Suspendisse potenti.",pwhithalgh81@paypal.com,Pate Whithalgh,159-500-6331,565-46-0248
291,cogglebie82,"[{},{},{}]",417-938-9984,Sed ante. Vivamus tortor. Duis mattis egestas metus.,cogglebie82@kickstarter.com,Clarabelle Ogglebie,733-207-0936,825-77-1442
292,ilaban83,"[{},{},{},{}]",455-519-0834,"Quisque id justo sit amet sapien dignissim vestibulum. Vestibulum ante ipsum primis in faucibus orci luctus et ultrices posuere cubilia Curae; Nulla dapibus dolor vel est. Donec odio justo, sollicitudin ut, suscipit a, feugiat et, eros.",ilaban83@cpanel.net,Idelle Laban,863-759-7396,639-26-2419
293,shylden84,"[{},{},{}]",619-503-5651,Pellentesque ultrices mattis odio.,shylden84@berkeley.edu,Salaidh Hylden,211-707-3830,819-86-8345
294,dspaight85,"[{},{},{},{}]",929-709-5629,"Donec ut mauris eget massa tempor convallis. Nulla neque libero, convallis eget, eleifend luctus, ultricies eu, nibh.",dspaight85@craigslist.org,Devlin Spaight,531-566-3152,319-71-0823
295,akrimmer86,"[{},{},{},{}]",115-191-0155,Etiam faucibus cursus urna. Ut tellus.,akrimmer86@dedecms.com,Asa Krimmer,221-956-9282,681-98-0163
296,dsoares87,"[{},{},{}]",872-114-7435,Aenean sit amet justo. Morbi ut odio.,dsoares87@behance.net,Dylan Soares,917-249-1065,388-32-4612
297,fmallows88,"[{},{}]",409-408-3660,"Vestibulum ac est lacinia nisi venenatis tristique. Fusce congue, diam id ornare imperdiet, sapien urna pretium nisl, ut volutpat sapien arcu sed augue.",fmallows88@nationalgeographic.com,Filberte Mallows,250-195-8540,310-44-6147
298,hchina89,"[{},{}]",275-594-8252,"Cum sociis natoque penatibus et magnis dis parturient montes, nascetur ridiculus mus. Etiam vel augue.",hchina89@dot.gov,Heda China,890-789-2923,412-79-8584
299,idowdney8a,"[{},{},{}]",878-519-6870,"Nulla ac enim. In tempor, turpis nec euismod scelerisque, quam turpis adipiscing lorem, vitae mattis nibh ligula nec sem.",idowdney8a@posterous.com,Ignaz Dowdney,575-892-4605,663-06-9730
300,mketteridge8b,"[{},{},{},{}]",937-741-6239,Vestibulum ante ipsum primis in faucibus orci luctus et ultrices posuere cubilia Curae; Duis faucibus accumsan odio. Curabitur convallis. Duis consequat dui nec nisi volutpat eleifend.,mketteridge8b@tripadvisor.com,Misha Ketteridge,790-548-5121,588-82-7321
301,hperryn8c,[],554-692-8327,Ut at dolor quis odio consequat varius. Integer ac leo.,hperryn8c@wunderground.com,Hillary Perryn,554-452-9611,315-61-8475
302,hcortez8d,"[{},{},{},{},{}]",458-646-4213,Vestibulum rutrum rutrum neque. Aenean auctor gravida sem. Praesent id massa id nisl venenatis lacinia.,hcortez8d@dedecms.com,Hermina Cortez,518-802-8172,227-83-4494
303,grase8e,[],896-871-2319,"In sagittis dui vel nisl. Duis ac nibh. Fusce lacus purus, aliquet at, feugiat non, pretium quis, lectus.",grase8e@hhs.gov,Gayelord Rase,331-224-8809,195-86-7272
304,lchritchley8f,"[{},{},{},{}]",727-660-4954,Mauris sit amet eros. Suspendisse accumsan tortor quis turpis.,lchritchley8f@phpbb.com,Lilian Chritchley,324-922-7474,773-08-2126
305,bspittles8g,"[{},{},{},{}]",414-807-6791,In hac habitasse platea dictumst.,bspittles8g@merriam-webster.com,Brigida Spittles,611-661-1835,611-11-4082
306,awedge8h,"[{},{}]",628-656-8788,Maecenas rhoncus aliquam lacus. Morbi quis tortor id nulla ultrices aliquet.,awedge8h@wikispaces.com,Amble Wedge,823-727-3779,469-01-9000
307,jsimonard8i,"[{},{},{},{},{}]",626-135-4552,Nunc nisl.,jsimonard8i@simplemachines.org,Jerrylee Simonard,880-366-1192,582-65-3700
308,chuertas8j,[{}],183-169-0802,"Nam nulla. Integer pede justo, lacinia eget, tincidunt eget, tempus vel, pede. Morbi porttitor lorem id ligula.",chuertas8j@wunderground.com,Corney Huertas,773-802-4908,641-34-2690
309,afoley8k,"[{},{},{},{}]",456-777-4888,Morbi non quam nec dui luctus rutrum. Nulla tellus. In sagittis dui vel nisl.,afoley8k@kickstarter.com,Amelia Foley,466-896-9268,395-85-4825
310,lpauler8l,[{}],367-963-2145,Quisque porta volutpat erat.,lpauler8l@chicagotribune.com,Leopold Pauler,352-838-6931,310-09-4188
311,ssirmond8m,"[{},{},{},{},{}]",729-786-9312,Praesent blandit lacinia erat. Vestibulum sed magna at nunc commodo placerat. Praesent blandit.,ssirmond8m@weibo.com,Shem Sirmond,653-336-9505,190-72-8749
312,fmetzke8n,"[{},{}]",858-248-4953,Donec ut dolor.,fmetzke8n@tuttocitta.it,Farlay Metzke,291-577-4228,429-66-4495
313,jmallock8o,"[{},{},{},{}]",881-496-6116,Duis aliquam convallis nunc.,jmallock8o@nsw.gov.au,Jaquelyn Mallock,408-978-7727,291-85-5849
314,ytarbett8p,"[{},{}]",901-765-4912,Curabitur gravida nisi at nibh.,ytarbett8p@odnoklassniki.ru,Yance Tarbett,670-590-0401,833-68-9148
315,cstag8q,[],177-416-9704,Aliquam erat volutpat.,cstag8q@ebay.com,Cordula Stag,464-832-6379,167-44-9570
316,mfirman8r,"[{},{},{},{},{}]",874-662-3267,Cras non velit nec nisi vulputate nonummy. Maecenas tincidunt lacus at velit.,mfirman8r@washingtonpost.com,Mei Firman,590-218-9445,503-18-7353
317,nmanna8s,"[{},{}]",146-481-4247,"Proin leo odio, porttitor id, consequat in, consequat ut, nulla. Sed accumsan felis. Ut at dolor quis odio consequat varius.",nmanna8s@mayoclinic.com,Nonna Manna,221-826-8729,735-47-6125
318,stallon8t,"[{},{},{},{},{}]",688-685-2309,Duis mattis egestas metus. Aenean fermentum. Donec ut mauris eget massa tempor convallis.,stallon8t@umich.edu,Shandee Tallon,167-629-6659,414-28-6964
319,hkleinsinger8u,"[{},{},{}]",194-909-6669,"Quisque erat eros, viverra eget, congue eget, semper rutrum, nulla. Nunc purus. Phasellus in felis.",hkleinsinger8u@unc.edu,Harmony Kleinsinger,702-540-8819,128-44-6549
320,bpreble8v,"[{},{},{},{},{}]",874-827-9974,Maecenas pulvinar lobortis est.,bpreble8v@aol.com,Bridie Preble,239-397-6932,630-73-1075
321,rramsier8w,"[{},{},{},{}]",749-490-0590,"Phasellus id sapien in sapien iaculis congue. Vivamus metus arcu, adipiscing molestie, hendrerit at, vulputate vitae, nisl. Aenean lectus.",rramsier8w@acquirethisname.com,Rosalinda Ramsier,230-328-2106,561-17-4096
322,bstaning8x,[{}],638-987-9595,Suspendisse potenti. Cras in purus eu magna vulputate luctus.,bstaning8x@i2i.jp,Bob Staning,224-704-3379,290-92-4828
323,llackeye8y,"[{},{},{}]",644-337-3442,In eleifend quam a odio. In hac habitasse platea dictumst.,llackeye8y@seattletimes.com,Lyndsey Lackeye,179-986-7244,282-83-0616
324,hpogosian8z,"[{},{},{},{}]",133-159-4300,Maecenas rhoncus aliquam lacus. Morbi quis tortor id nulla ultrices aliquet.,hpogosian8z@youku.com,Huberto Pogosian,999-506-0540,851-15-8709
325,mascrofte90,"[{},{}]",544-636-6776,Etiam pretium iaculis justo. In hac habitasse platea dictumst.,mascrofte90@yolasite.com,Marena Ascrofte,974-465-5242,591-72-2975
326,wurey91,"[{},{},{},{}]",521-494-3529,"Cum sociis natoque penatibus et magnis dis parturient montes, nascetur ridiculus mus.",wurey91@furl.net,Waldo Urey,931-193-1139,595-49-7307
327,mschorah92,[{}],615-669-2788,Donec posuere metus vitae ipsum. Aliquam non mauris. Morbi non lectus.,mschorah92@ebay.com,Marlyn Schorah,767-685-6841,254-42-6299
328,asafell93,"[{},{}]",268-840-2914,Pellentesque eget nunc.,asafell93@people.com.cn,Abeu Safell,256-567-7493,338-58-0156
329,jkilrow94,[{}],102-375-5158,Suspendisse potenti.,jkilrow94@hao123.com,Jeddy Kilrow,504-946-5405,897-35-8912
330,gsimonian95,"[{},{},{},{}]",776-196-6439,Quisque id justo sit amet sapien dignissim vestibulum. Vestibulum ante ipsum primis in faucibus orci luctus et ultrices posuere cubilia Curae; Nulla dapibus dolor vel est.,gsimonian95@techcrunch.com,Gilemette Simonian,936-891-9904,876-60-9814
331,vweale96,[],126-536-3149,Praesent id massa id nisl venenatis lacinia. Aenean sit amet justo. Morbi ut odio.,vweale96@loc.gov,Vassili Weale,476-446-2038,792-85-1143
332,ineath97,"[{},{}]",929-714-2839,Aliquam non mauris. Morbi non lectus. Aliquam sit amet diam in magna bibendum imperdiet.,ineath97@reference.com,Inessa Neath,875-408-3696,766-51-4865
333,apilbury98,[],135-240-9535,"Vestibulum ante ipsum primis in faucibus orci luctus et ultrices posuere cubilia Curae; Donec pharetra, magna vestibulum aliquet ultrices, erat tortor sollicitudin mi, sit amet lobortis sapien sapien non mi.",apilbury98@reference.com,Alfredo Pilbury,711-155-2271,807-96-0795
334,abeckerleg99,"[{},{},{},{}]",719-801-2525,"Fusce posuere felis sed lacus. Morbi sem mauris, laoreet ut, rhoncus aliquet, pulvinar sed, nisl. Nunc rhoncus dui vel sem.",abeckerleg99@de.vu,Alissa Beckerleg,323-636-5896,605-91-6611
335,wsproul9a,"[{},{},{},{}]",842-499-0165,Vivamus in felis eu sapien cursus vestibulum.,wsproul9a@blogspot.com,Wallie Sproul,574-755-7327,286-43-5767
336,agartsyde9b,[{}],274-320-4763,Donec ut mauris eget massa tempor convallis.,agartsyde9b@163.com,Alina Gartsyde,629-172-6290,634-89-0427
337,dmcgarvey9c,"[{},{},{},{}]",427-776-3812,"Donec ut dolor. Morbi vel lectus in quam fringilla rhoncus. Mauris enim leo, rhoncus sed, vestibulum sit amet, cursus id, turpis.",dmcgarvey9c@nsw.gov.au,David McGarvey,810-932-1261,454-84-2600
338,saccum9d,[],507-810-9051,"Maecenas tristique, est et tempus semper, est quam pharetra magna, ac consequat metus sapien ut nunc. Vestibulum ante ipsum primis in faucibus orci luctus et ultrices posuere cubilia Curae; Mauris viverra diam vitae quam. Suspendisse potenti.",saccum9d@elegantthemes.com,Stanfield Accum,682-525-2951,675-95-9166
339,tchessell9e,"[{},{}]",875-150-4448,In hac habitasse platea dictumst. Etiam faucibus cursus urna. Ut tellus.,tchessell9e@hibu.com,Torrin Chessell,269-484-4180,306-49-1035
340,habba9f,"[{},{},{},{}]",305-260-3368,"Aliquam augue quam, sollicitudin vitae, consectetuer eget, rutrum at, lorem. Integer tincidunt ante vel ipsum. Praesent blandit lacinia erat.",habba9f@nsw.gov.au,Hilary Abba,122-883-4113,713-56-7693
341,ecowitz9g,"[{},{},{}]",644-745-7076,Duis at velit eu est congue elementum.,ecowitz9g@163.com,Efrem Cowitz,260-167-3652,893-05-0943
342,jpiggin9h,[],674-620-8124,"Donec vitae nisi. Nam ultrices, libero non mattis pulvinar, nulla pede ullamcorper augue, a suscipit nulla elit ac nulla.",jpiggin9h@vimeo.com,Jennifer Piggin,456-296-9282,231-28-1926
343,rlinkie9i,"[{},{},{},{},{}]",210-276-2681,"Nullam orci pede, venenatis non, sodales sed, tincidunt eu, felis.",rlinkie9i@adobe.com,Rosetta Linkie,196-414-7774,731-83-3836
344,sskellen9j,"[{},{},{},{}]",994-766-6647,Nullam porttitor lacus at turpis. Donec posuere metus vitae ipsum.,sskellen9j@wikimedia.org,Stern Skellen,172-314-8278,550-36-6027
345,nszymonowicz9k,[],113-262-6342,Donec quis orci eget orci vehicula condimentum. Curabitur in libero ut massa volutpat convallis.,nszymonowicz9k@homestead.com,Nissy Szymonowicz,306-164-1477,793-72-3829
346,acorston9l,"[{},{}]",239-765-8376,Etiam justo. Etiam pretium iaculis justo. In hac habitasse platea dictumst.,acorston9l@chronoengine.com,Ashla Corston,661-291-0212,431-44-1934
347,vwoolen9m,[],580-964-8968,Vestibulum ante ipsum primis in faucibus orci luctus et ultrices posuere cubilia Curae; Mauris viverra diam vitae quam. Suspendisse potenti. Nullam porttitor lacus at turpis.,vwoolen9m@amazon.co.uk,Vincents Woolen,610-989-0632,554-85-9099
348,nknapton9n,[],456-127-0161,Ut at dolor quis odio consequat varius. Integer ac leo. Pellentesque ultrices mattis odio.,nknapton9n@yahoo.co.jp,Norah Knapton,942-504-1020,386-26-9055
349,cde9o,[{}],685-852-4786,"Nulla ac enim. In tempor, turpis nec euismod scelerisque, quam turpis adipiscing lorem, vitae mattis nibh ligula nec sem.",cde9o@hatena.ne.jp,Caspar De Beneditti,474-933-8115,861-29-2482
350,ubidder9p,[{}],789-212-6018,"Nulla nisl. Nunc nisl. Duis bibendum, felis sed interdum venenatis, turpis enim blandit mi, in porttitor pede justo eu massa.",ubidder9p@ted.com,Ulrikaumeko Bidder,937-291-7428,138-95-3321
351,kirving9q,"[{},{},{},{},{}]",693-653-3544,Curabitur convallis. Duis consequat dui nec nisi volutpat eleifend. Donec ut dolor.,kirving9q@shinystat.com,Kore Irving,122-396-6286,722-20-2597
352,smaccosty9r,"[{},{},{}]",479-884-1414,"Proin risus. Praesent lectus. Vestibulum quam sapien, varius ut, blandit non, interdum in, ante.",smaccosty9r@utexas.edu,Sallyanne MacCosty,264-981-3999,355-55-8386
353,ccambell9s,[],626-884-1201,Curabitur gravida nisi at nibh.,ccambell9s@wix.com,Cam Cambell,280-277-3447,552-01-9675
354,cde9t,[],738-613-4269,"Integer aliquet, massa id lobortis convallis, tortor risus dapibus augue, vel accumsan tellus nisi eu orci. Mauris lacinia sapien quis libero. Nullam sit amet turpis elementum ligula vehicula consequat.",cde9t@usatoday.com,Christiane De Launde,156-776-9530,678-24-7829
355,ikeslake9u,"[{},{},{}]",332-334-9270,Nulla facilisi. Cras non velit nec nisi vulputate nonummy. Maecenas tincidunt lacus at velit.,ikeslake9u@businessweek.com,Isadore Keslake,521-860-2207,139-70-9109
356,ccovotto9v,[{}],942-373-0844,Nullam sit amet turpis elementum ligula vehicula consequat.,ccovotto9v@addtoany.com,Cele Covotto,280-809-3600,200-59-2436
357,rhaughey9w,"[{},{}]",762-875-0486,"Maecenas leo odio, condimentum id, luctus nec, molestie sed, justo.",rhaughey9w@example.com,Ryann Haughey,376-755-7875,452-62-2971
358,tkeysel9x,[{}],116-880-4822,Maecenas pulvinar lobortis est. Phasellus sit amet erat. Nulla tempus.,tkeysel9x@spotify.com,Terrijo Keysel,554-490-2992,122-51-1318
359,snorthover9y,[],727-980-3244,"Mauris ullamcorper purus sit amet nulla. Quisque arcu libero, rutrum ac, lobortis vel, dapibus at, diam. Nam tristique tortor eu pede.",snorthover9y@time.com,Samuel Northover,122-206-7847,380-98-9071
360,elevene9z,[{}],429-887-2745,"Donec diam neque, vestibulum eget, vulputate ut, ultrices vel, augue.",elevene9z@free.fr,Edgar Levene,145-372-9574,671-99-3652
361,mromneya0,[],346-370-1576,Ut at dolor quis odio consequat varius. Integer ac leo. Pellentesque ultrices mattis odio.,mromneya0@sohu.com,Merrili Romney,119-978-2179,697-95-0021
362,hegletona1,"[{},{},{},{},{}]",603-974-0515,"Morbi sem mauris, laoreet ut, rhoncus aliquet, pulvinar sed, nisl. Nunc rhoncus dui vel sem. Sed sagittis.",hegletona1@rambler.ru,Hastie Egleton,257-120-2338,206-23-4297
363,kashingdena2,[{}],666-485-1129,"Nam congue, risus semper porta volutpat, quam pede lobortis ligula, sit amet eleifend pede libero quis orci. Nullam molestie nibh in lectus.",kashingdena2@last.fm,Konrad Ashingden,318-532-7911,444-13-0497
364,dpinnocka3,[{}],319-684-1975,Aenean sit amet justo.,dpinnocka3@nifty.com,Demetri Pinnock,232-845-2067,596-53-9664
365,bdeshortsa4,"[{},{},{}]",314-943-5494,Morbi non quam nec dui luctus rutrum.,bdeshortsa4@bigcartel.com,Britt Deshorts,116-381-3226,711-97-4013
366,asicelya5,[{}],596-977-6543,Aliquam quis turpis eget elit sodales scelerisque. Mauris sit amet eros. Suspendisse accumsan tortor quis turpis.,asicelya5@paginegialle.it,Allan Sicely,923-878-5477,226-92-8688
367,rbignolda6,"[{},{},{}]",316-940-5968,"Morbi vel lectus in quam fringilla rhoncus. Mauris enim leo, rhoncus sed, vestibulum sit amet, cursus id, turpis.",rbignolda6@comsenz.com,Richard Bignold,856-959-4840,428-93-8409
368,bquickfalla7,[],932-671-5817,Donec quis orci eget orci vehicula condimentum.,bquickfalla7@so-net.ne.jp,Barri Quickfall,731-957-8446,746-33-6400
369,bmilhama8,"[{},{}]",693-875-8742,"Praesent lectus. Vestibulum quam sapien, varius ut, blandit non, interdum in, ante.",bmilhama8@sogou.com,Brig Milham,956-557-6458,302-05-8876
370,aibaneza9,"[{},{}]",672-720-9866,"Cum sociis natoque penatibus et magnis dis parturient montes, nascetur ridiculus mus. Etiam vel augue.",aibaneza9@freewebs.com,Ashley Ibanez,745-418-7886,590-17-5066
371,dlinsayaa,[],815-224-1877,Praesent blandit.,dlinsayaa@berkeley.edu,Darleen Linsay,794-663-9199,147-29-9119
372,jhastilowab,"[{},{},{},{},{}]",351-324-5478,Fusce consequat. Nulla nisl.,jhastilowab@dropbox.com,Jeniffer Hastilow,288-686-5223,795-65-1692
373,mmintoac,"[{},{},{},{},{}]",124-182-3216,"Mauris enim leo, rhoncus sed, vestibulum sit amet, cursus id, turpis.",mmintoac@addtoany.com,Michaelina Minto,586-374-7305,722-51-8744
374,mpurkinsad,"[{},{},{},{}]",409-913-9306,Sed vel enim sit amet nunc viverra dapibus. Nulla suscipit ligula in lacus. Curabitur at ipsum ac tellus semper interdum.,mpurkinsad@hostgator.com,Margarette Purkins,402-983-1963,794-64-5633
375,bpickleae,[],190-361-1045,"Nulla neque libero, convallis eget, eleifend luctus, ultricies eu, nibh. Quisque id justo sit amet sapien dignissim vestibulum.",bpickleae@odnoklassniki.ru,Bettye Pickle,469-235-3573,856-13-2360
376,gclilverdaf,"[{},{},{}]",131-442-9490,Aenean fermentum.,gclilverdaf@ning.com,Gardner Clilverd,275-789-2449,346-12-7743
377,npugheag,[],221-237-0731,Phasellus sit amet erat. Nulla tempus.,npugheag@un.org,Nowell Pughe,579-821-9663,837-71-9821
378,kbraidleyah,[{}],469-707-2097,Mauris sit amet eros.,kbraidleyah@wikimedia.org,Kile Braidley,343-533-5441,636-02-2219
379,sfisonai,"[{},{},{},{}]",714-159-5498,"Donec quis orci eget orci vehicula condimentum. Curabitur in libero ut massa volutpat convallis. Morbi odio odio, elementum eu, interdum eu, tincidunt in, leo.",sfisonai@howstuffworks.com,Stormie Fison,552-925-4377,294-41-9627
380,draweaj,"[{},{}]",595-891-0826,"Donec odio justo, sollicitudin ut, suscipit a, feugiat et, eros. Vestibulum ac est lacinia nisi venenatis tristique.",draweaj@drupal.org,Danika Rawe,890-988-1326,417-14-7056
381,stweedieak,[],904-742-7980,Aliquam erat volutpat.,stweedieak@jimdo.com,Shaine Tweedie,199-140-0825,490-98-8332
382,ggilksal,"[{},{},{},{},{}]",668-287-8341,"Morbi odio odio, elementum eu, interdum eu, tincidunt in, leo. Maecenas pulvinar lobortis est.",ggilksal@ft.com,Gilberta Gilks,863-875-6515,616-14-4489
383,fmcclarenam,"[{},{},{},{},{}]",216-637-7960,Nulla nisl.,fmcclarenam@fastcompany.com,Farris McClaren,265-543-6292,810-56-1236
384,gdagostinian,"[{},{},{},{}]",122-132-4316,Integer ac neque. Duis bibendum. Morbi non quam nec dui luctus rutrum.,gdagostinian@technorati.com,Gabbi D'Agostini,169-173-2287,409-15-8544
385,shitchamao,"[{},{},{},{}]",562-447-5517,Quisque porta volutpat erat.,shitchamao@washingtonpost.com,Saba Hitcham,839-772-4218,596-49-1129
386,fkewardap,"[{},{},{},{},{}]",564-507-9340,"Vestibulum ante ipsum primis in faucibus orci luctus et ultrices posuere cubilia Curae; Donec pharetra, magna vestibulum aliquet ultrices, erat tortor sollicitudin mi, sit amet lobortis sapien sapien non mi. Integer ac neque. Duis bibendum.",fkewardap@gov.uk,Franky Keward,824-115-7273,822-42-6809
387,lpettiferaq,"[{},{},{},{},{}]",364-749-9662,"In hac habitasse platea dictumst. Morbi vestibulum, velit id pretium iaculis, diam erat fermentum justo, nec condimentum neque sapien placerat ante.",lpettiferaq@blogspot.com,Laurence Pettifer,781-501-8719,847-25-5116
388,etapsfieldar,[{}],683-442-3738,"Morbi ut odio. Cras mi pede, malesuada in, imperdiet et, commodo vulputate, justo.",etapsfieldar@wikia.com,Emma Tapsfield,395-384-4578,795-30-7916
389,criggertas,"[{},{},{},{},{}]",518-245-8939,"Pellentesque ultrices mattis odio. Donec vitae nisi. Nam ultrices, libero non mattis pulvinar, nulla pede ullamcorper augue, a suscipit nulla elit ac nulla.",criggertas@amazonaws.com,Concordia Riggert,875-820-3238,422-61-9146
390,vrobackat,[{}],150-805-3740,Mauris lacinia sapien quis libero. Nullam sit amet turpis elementum ligula vehicula consequat.,vrobackat@bizjournals.com,Vicki Roback,418-218-2399,617-22-1366
391,kburnhillau,"[{},{},{},{},{}]",238-505-2939,Aenean lectus. Pellentesque eget nunc.,kburnhillau@forbes.com,Karena Burnhill,109-378-5863,897-37-2710
392,dmaccolganav,"[{},{},{},{}]",526-748-6283,Donec semper sapien a libero.,dmaccolganav@google.fr,Dukie MacColgan,340-566-1726,507-95-3929
393,imaccurtainaw,"[{},{},{}]",219-667-0508,Nulla ut erat id mauris vulputate elementum. Nullam varius.,imaccurtainaw@slashdot.org,Immanuel MacCurtain,896-948-2555,872-55-9453
394,ccruddaceax,"[{},{},{},{},{}]",795-444-6622,"Donec quis orci eget orci vehicula condimentum. Curabitur in libero ut massa volutpat convallis. Morbi odio odio, elementum eu, interdum eu, tincidunt in, leo.",ccruddaceax@stanford.edu,Cris Cruddace,404-672-6748,276-96-4396
395,mmordonay,"[{},{},{},{},{}]",842-480-2772,Suspendisse potenti. Nullam porttitor lacus at turpis.,mmordonay@engadget.com,Merrie Mordon,262-154-9470,651-09-4626
396,ogoodramaz,[],471-169-6831,Duis ac nibh.,ogoodramaz@free.fr,Orella Goodram,959-521-3627,388-11-8803
397,scrichtonb0,"[{},{},{}]",620-566-9995,Ut at dolor quis odio consequat varius. Integer ac leo.,scrichtonb0@mail.ru,Stefan Crichton,790-154-3455,624-47-4436
398,cdrieub1,"[{},{},{},{}]",102-191-9677,"Nunc nisl. Duis bibendum, felis sed interdum venenatis, turpis enim blandit mi, in porttitor pede justo eu massa.",cdrieub1@linkedin.com,Carny Drieu,803-473-4286,380-49-8772
399,gbertheb2,"[{},{},{},{},{}]",718-763-1069,Phasellus sit amet erat. Nulla tempus.,gbertheb2@bluehost.com,Griswold Berthe,376-331-1715,632-62-0344
400,umaccagueb3,"[{},{},{},{},{}]",367-356-0209,Nulla suscipit ligula in lacus.,umaccagueb3@liveinternet.ru,Urbanus MacCague,785-360-4702,571-72-4550
401,herrichiellob4,[{}],868-605-7645,Aliquam non mauris. Morbi non lectus.,herrichiellob4@umich.edu,Hermann Errichiello,416-935-9104,639-13-1799
402,adanilyakb5,"[{},{},{},{},{}]",753-253-1457,"Curabitur at ipsum ac tellus semper interdum. Mauris ullamcorper purus sit amet nulla. Quisque arcu libero, rutrum ac, lobortis vel, dapibus at, diam.",adanilyakb5@theatlantic.com,Ag Danilyak,358-336-1870,717-30-1915
403,bsherrottb6,[],791-711-2812,Sed vel enim sit amet nunc viverra dapibus.,bsherrottb6@hibu.com,Bernie Sherrott,294-684-6570,663-07-0804
404,agasgarthb7,"[{},{},{}]",411-896-7160,Nulla ut erat id mauris vulputate elementum. Nullam varius. Nulla facilisi.,agasgarthb7@de.vu,Atalanta Gasgarth,599-496-4691,839-88-7038
405,agruczkab8,"[{},{},{},{},{}]",940-946-2720,Duis mattis egestas metus.,agruczkab8@cisco.com,Amara Gruczka,436-880-9864,261-03-1397
406,wgallamoreb9,"[{},{}]",527-988-1043,Duis bibendum. Morbi non quam nec dui luctus rutrum.,wgallamoreb9@domainmarket.com,Wendeline Gallamore,308-817-0358,870-50-3340
407,ggollyba,"[{},{},{},{},{}]",783-782-3685,Sed vel enim sit amet nunc viverra dapibus. Nulla suscipit ligula in lacus.,ggollyba@gnu.org,Gracie Golly,651-853-6937,711-60-5129
408,conolandbb,"[{},{},{},{}]",995-777-3572,"Morbi vestibulum, velit id pretium iaculis, diam erat fermentum justo, nec condimentum neque sapien placerat ante. Nulla justo. Aliquam quis turpis eget elit sodales scelerisque.",conolandbb@spotify.com,Carla O'Noland,522-345-2605,232-40-5208
409,abownessbc,"[{},{},{},{}]",872-542-5268,"Maecenas leo odio, condimentum id, luctus nec, molestie sed, justo.",abownessbc@ezinearticles.com,Arleyne Bowness,847-969-4487,362-63-7894
410,ccorsarbd,"[{},{}]",216-248-0632,Nullam porttitor lacus at turpis.,ccorsarbd@omniture.com,Colet Corsar,618-565-5052,336-10-5949
411,srodgerbe,[{}],933-718-5297,Aliquam non mauris.,srodgerbe@tamu.edu,Smitty Rodger,855-240-7301,870-12-7020
412,lhaldonbf,"[{},{},{},{}]",249-834-7649,"Cum sociis natoque penatibus et magnis dis parturient montes, nascetur ridiculus mus. Etiam vel augue.",lhaldonbf@xinhuanet.com,Lolita Haldon,762-663-8938,280-47-2501
413,lleatherborrowbg,"[{},{},{}]",667-969-2056,Nulla facilisi. Cras non velit nec nisi vulputate nonummy. Maecenas tincidunt lacus at velit.,lleatherborrowbg@cocolog-nifty.com,Lise Leatherborrow,580-271-3431,576-85-5027
