id,username,user_preferences,contact_number,user_bio,email_sensitive,full_name_sensitive,phone_number_sensitive,ssn_sensitive
558,rbissonfh,[{}],115-670-2251,"Vivamus metus arcu, adipiscing molestie, hendrerit at, vulputate vitae, nisl. Aenean lectus. Pellentesque eget nunc.",rbissonfh@disqus.com,Rodge Bisson,183-729-0933,515-58-9938
559,jhulsefi,"[{},{},{}]",310-280-6771,"Vivamus metus arcu, adipiscing molestie, hendrerit at, vulputate vitae, nisl. Aenean lectus. Pellentesque eget nunc.",jhulsefi@cbc.ca,Josee Hulse,135-213-1514,122-10-3788
560,ocookefj,"[{},{},{},{}]",126-474-5550,"Maecenas rhoncus aliquam lacus. Morbi quis tortor id nulla ultrices aliquet. Maecenas leo odio, condimentum id, luctus nec, molestie sed, justo.",ocookefj@slashdot.org,Olwen Cooke,472-485-3325,502-21-1554
561,nhubballfk,"[{},{},{}]",911-808-8875,"Vivamus vestibulum sagittis sapien. Cum sociis natoque penatibus et magnis dis parturient montes, nascetur ridiculus mus.",nhubballfk@exblog.jp,Nikaniki Hubball,832-300-9376,678-73-6784
562,rwoodsfordfl,[{}],382-461-6934,Etiam vel augue.,rwoodsfordfl@cmu.edu,Rik Woodsford,792-404-9302,724-60-0217
563,ganwellfm,[{}],481-409-8393,Nulla tempus. Vivamus in felis eu sapien cursus vestibulum. Proin eu mi.,ganwellfm@whitehouse.gov,Gabbie Anwell,985-983-0964,322-48-6232
564,jnoweakfn,"[{},{},{}]",706-552-8270,Mauris sit amet eros. Suspendisse accumsan tortor quis turpis.,jnoweakfn@google.co.uk,Jasmine Noweak,236-691-8002,148-03-4151
565,askeatfo,"[{},{},{}]",206-381-6629,Integer ac neque. Duis bibendum. Morbi non quam nec dui luctus rutrum.,askeatfo@nasa.gov,Ashley Skeat,255-511-4103,797-81-6914
566,ghelliwellfp,"[{},{}]",288-580-8805,Praesent lectus.,ghelliwellfp@example.com,Garwood Helliwell,598-173-6684,783-59-5798
567,hlyttlefq,"[{},{},{},{},{}]",722-526-8402,"Pellentesque ultrices mattis odio. Donec vitae nisi. Nam ultrices, libero non mattis pulvinar, nulla pede ullamcorper augue, a suscipit nulla elit ac nulla.",hlyttlefq@dailymail.co.uk,Herbie Lyttle,355-760-7249,309-16-4812
568,lbarrandfr,"[{},{},{},{},{}]",340-286-6971,"Proin leo odio, porttitor id, consequat in, consequat ut, nulla. Sed accumsan felis.",lbarrandfr@lulu.com,Lauren Barrand,343-210-5324,317-73-9999
569,aleyrefs,"[{},{},{}]",884-367-7121,Nulla facilisi. Cras non velit nec nisi vulputate nonummy.,aleyrefs@java.com,Alexandros Leyre,276-348-2323,434-15-7938
570,dslemmingft,"[{},{},{},{}]",704-517-2010,Duis ac nibh.,dslemmingft@deviantart.com,Donetta Slemming,751-600-5438,604-22-9322
571,sjearyfu,"[{},{},{},{}]",317-680-5516,Curabitur gravida nisi at nibh.,sjearyfu@nasa.gov,Sawyere Jeary,810-472-9372,359-49-1091
572,elangsburyfv,"[{},{},{}]",234-213-3734,Sed ante. Vivamus tortor. Duis mattis egestas metus.,elangsburyfv@quantcast.com,Esther Langsbury,670-637-8203,530-24-5997
573,joffenerfw,"[{},{},{},{}]",636-220-5952,Morbi vel lectus in quam fringilla rhoncus.,joffenerfw@parallels.com,Joelynn Offener,654-808-7259,543-89-6137
574,ktrekerfx,"[{},{},{},{},{}]",519-614-6005,"In est risus, auctor sed, tristique in, tempus sit amet, sem.",ktrekerfx@sbwire.com,Ketty Treker,651-798-3241,555-59-4474
575,brandalsonfy,[],859-756-7085,"Morbi vel lectus in quam fringilla rhoncus. Mauris enim leo, rhoncus sed, vestibulum sit amet, cursus id, turpis.",brandalsonfy@dion.ne.jp,Beau Randalson,279-791-1372,558-80-7712
576,cmcilroyfz,[{}],220-781-6442,"Integer pede justo, lacinia eget, tincidunt eget, tempus vel, pede. Morbi porttitor lorem id ligula.",cmcilroyfz@qq.com,Charles McIlroy,901-949-2942,835-78-5648
577,mwallegeg0,[],369-170-2726,"Mauris ullamcorper purus sit amet nulla. Quisque arcu libero, rutrum ac, lobortis vel, dapibus at, diam. Nam tristique tortor eu pede.",mwallegeg0@noaa.gov,Mathian Wallege,265-690-2469,227-05-4855
578,ewenmang1,"[{},{},{},{}]",275-496-7791,In quis justo.,ewenmang1@icio.us,Emera Wenman,624-109-3757,456-98-3667
579,mgaythwaiteg2,"[{},{}]",489-659-9796,Sed vel enim sit amet nunc viverra dapibus. Nulla suscipit ligula in lacus. Curabitur at ipsum ac tellus semper interdum.,mgaythwaiteg2@toplist.cz,Martita Gaythwaite,633-840-7591,558-35-3958
580,tkeayg3,[],327-919-2498,Mauris sit amet eros. Suspendisse accumsan tortor quis turpis. Sed ante.,tkeayg3@patch.com,Thebault Keay,948-363-5423,217-72-6872
581,bwoofindeng4,[],844-783-8300,In hac habitasse platea dictumst.,bwoofindeng4@hubpages.com,Bamby Woofinden,234-178-4469,557-07-0803
582,llakemang5,[{}],822-893-0325,Duis consequat dui nec nisi volutpat eleifend. Donec ut dolor. Morbi vel lectus in quam fringilla rhoncus.,llakemang5@baidu.com,Lyn Lakeman,470-939-1317,190-08-9324
583,gpatemoreg6,"[{},{},{},{}]",728-277-8556,"Duis bibendum, felis sed interdum venenatis, turpis enim blandit mi, in porttitor pede justo eu massa.",gpatemoreg6@123-reg.co.uk,Gilbertina Patemore,212-372-7951,370-87-5508
584,cscrivnerg7,"[{},{},{},{},{}]",820-260-4516,"Nam congue, risus semper porta volutpat, quam pede lobortis ligula, sit amet eleifend pede libero quis orci. Nullam molestie nibh in lectus. Pellentesque at nulla.",cscrivnerg7@ucsd.edu,Cindelyn Scrivner,390-314-6793,734-79-8992
585,econnockg8,[],915-727-0446,"Donec diam neque, vestibulum eget, vulputate ut, ultrices vel, augue. Vestibulum ante ipsum primis in faucibus orci luctus et ultrices posuere cubilia Curae; Donec pharetra, magna vestibulum aliquet ultrices, erat tortor sollicitudin mi, sit amet lobortis sapien sapien non mi.",econnockg8@geocities.com,Elyssa Connock,607-699-0522,665-36-6826
586,lcroixg9,[{}],913-790-1441,Nulla suscipit ligula in lacus.,lcroixg9@geocities.com,Lukas Croix,875-432-4106,164-58-9477
587,ksherelga,"[{},{},{}]",436-409-6949,Aliquam quis turpis eget elit sodales scelerisque. Mauris sit amet eros. Suspendisse accumsan tortor quis turpis.,ksherelga@gizmodo.com,Kamilah Sherel,902-154-1729,803-18-5377
588,cduchartgb,"[{},{}]",561-119-1557,"Lorem ipsum dolor sit amet, consectetuer adipiscing elit. Proin interdum mauris non ligula pellentesque ultrices.",cduchartgb@dailymotion.com,Clari Duchart,255-839-5549,731-49-4312
589,tbraitlinggc,"[{},{},{},{},{}]",991-468-3027,Integer ac leo.,tbraitlinggc@360.cn,Tisha Braitling,438-407-7432,165-36-9040
590,psheerangd,"[{},{},{}]",476-309-6108,Curabitur gravida nisi at nibh. In hac habitasse platea dictumst.,psheerangd@google.com.au,Paige Sheeran,964-468-0216,547-16-1690
591,rlangmaidge,"[{},{},{}]",826-499-1121,"Vestibulum ante ipsum primis in faucibus orci luctus et ultrices posuere cubilia Curae; Nulla dapibus dolor vel est. Donec odio justo, sollicitudin ut, suscipit a, feugiat et, eros.",rlangmaidge@umn.edu,Rudolf Langmaid,639-563-8410,894-09-4346
592,dmacgauhygf,[],273-447-7121,Etiam pretium iaculis justo. In hac habitasse platea dictumst. Etiam faucibus cursus urna.,dmacgauhygf@pcworld.com,Dosi MacGauhy,646-263-6557,852-85-4542
593,egeldertgg,[],668-643-4651,"Maecenas tristique, est et tempus semper, est quam pharetra magna, ac consequat metus sapien ut nunc. Vestibulum ante ipsum primis in faucibus orci luctus et ultrices posuere cubilia Curae; Mauris viverra diam vitae quam.",egeldertgg@sfgate.com,Edithe Geldert,335-749-5802,628-27-1917
594,aganngh,"[{},{},{},{}]",801-235-6970,Nullam molestie nibh in lectus. Pellentesque at nulla. Suspendisse potenti.,aganngh@mail.ru,Anatollo Gann,558-209-0113,115-56-0683
595,ileivesleygi,"[{},{}]",594-505-0161,Nunc purus.,ileivesleygi@japanpost.jp,Ingrid Leivesley,930-512-0350,862-29-1250
596,astendellgj,"[{},{},{},{},{}]",887-916-9132,Curabitur in libero ut massa volutpat convallis.,astendellgj@ucsd.edu,Alwyn Stendell,102-928-1288,563-25-7030
597,kyuranovevgk,"[{},{},{},{},{}]",753-844-8867,"Aliquam augue quam, sollicitudin vitae, consectetuer eget, rutrum at, lorem. Integer tincidunt ante vel ipsum.",kyuranovevgk@discuz.net,Ketty Yuranovev,347-107-2560,367-04-3288
598,bbohangl,"[{},{}]",108-339-0924,Integer ac leo. Pellentesque ultrices mattis odio.,bbohangl@mail.ru,Bobine Bohan,651-878-3783,415-15-0693
599,cmclainegm,[{}],501-249-0896,Maecenas pulvinar lobortis est. Phasellus sit amet erat.,cmclainegm@macromedia.com,Corrine McLaine,312-702-4505,584-97-9050
600,rmendozagn,"[{},{},{}]",812-636-8371,"In est risus, auctor sed, tristique in, tempus sit amet, sem.",rmendozagn@weather.com,Rriocard Mendoza,452-108-1061,409-50-5754
601,alumoxgo,"[{},{},{},{}]",532-514-7462,In blandit ultrices enim.,alumoxgo@thetimes.co.uk,Annalee Lumox,853-849-0687,543-81-4747
602,kgreatedgp,"[{},{}]",699-330-9869,"Morbi ut odio. Cras mi pede, malesuada in, imperdiet et, commodo vulputate, justo.",kgreatedgp@unblog.fr,Kaitlin Greated,653-865-5063,250-74-4741
603,bwhitwhamgq,"[{},{},{},{}]",852-789-1646,"Nulla neque libero, convallis eget, eleifend luctus, ultricies eu, nibh.",bwhitwhamgq@hud.gov,Britt Whitwham,982-347-3090,207-43-5609
604,lcowthartgr,[],293-637-5514,Nulla ut erat id mauris vulputate elementum. Nullam varius. Nulla facilisi.,lcowthartgr@naver.com,Lisbeth Cowthart,502-631-5742,206-18-8955
605,bklemenzgs,[{}],666-771-5679,Sed ante.,bklemenzgs@tripadvisor.com,Bea Klemenz,559-609-1999,532-63-4504
606,sjurgesgt,"[{},{},{},{},{}]",687-908-2598,"Morbi sem mauris, laoreet ut, rhoncus aliquet, pulvinar sed, nisl. Nunc rhoncus dui vel sem.",sjurgesgt@ft.com,Simeon Jurges,796-688-4339,557-25-5659
607,lastletgu,"[{},{},{},{},{}]",774-817-4656,Nulla suscipit ligula in lacus. Curabitur at ipsum ac tellus semper interdum.,lastletgu@washingtonpost.com,Loraine Astlet,523-465-4665,434-59-2095
608,rporteousgv,[{}],419-989-0153,Vivamus vel nulla eget eros elementum pellentesque. Quisque porta volutpat erat.,rporteousgv@ovh.net,Rhianon Porteous,204-875-0729,411-78-3513
609,rmacinherneygw,[{}],691-759-1262,Duis bibendum. Morbi non quam nec dui luctus rutrum. Nulla tellus.,rmacinherneygw@foxnews.com,Regan MacInherney,745-758-8326,667-38-9650
610,lyoungsgx,[{}],847-223-2353,"Nunc rhoncus dui vel sem. Sed sagittis. Nam congue, risus semper porta volutpat, quam pede lobortis ligula, sit amet eleifend pede libero quis orci.",lyoungsgx@narod.ru,Leonelle Youngs,457-510-8198,511-24-3295
611,sdonaldgy,"[{},{},{},{},{}]",857-361-2686,"Proin leo odio, porttitor id, consequat in, consequat ut, nulla.",sdonaldgy@plala.or.jp,Sara Donald,443-608-3333,392-70-0176
612,dfleethamgz,[],786-518-7853,"Vivamus vestibulum sagittis sapien. Cum sociis natoque penatibus et magnis dis parturient montes, nascetur ridiculus mus.",dfleethamgz@surveymonkey.com,Devondra Fleetham,657-693-7603,349-31-0705
613,ctootalh0,[],477-995-5285,Etiam pretium iaculis justo.,ctootalh0@slashdot.org,Cheston Tootal,464-641-3666,260-13-4803
614,vcleugherh1,[],691-665-7345,"Nam dui. Proin leo odio, porttitor id, consequat in, consequat ut, nulla.",vcleugherh1@chron.com,Verne Cleugher,644-835-2428,228-23-3508
615,mboggersh2,[],787-668-4471,Quisque porta volutpat erat.,mboggersh2@bloglines.com,May Boggers,644-870-5608,671-44-6137
616,wtatemh3,"[{},{},{}]",249-614-6859,Proin risus.,wtatemh3@apache.org,Washington Tatem,452-416-7541,721-85-5760
617,mcotgroveh4,"[{},{},{}]",427-213-1115,Suspendisse potenti.,mcotgroveh4@google.co.uk,Minne Cotgrove,751-629-3634,364-59-4538
618,sswindellh5,"[{},{},{},{},{}]",219-607-3151,Suspendisse potenti. In eleifend quam a odio. In hac habitasse platea dictumst.,sswindellh5@gnu.org,Sandy Swindell,611-811-4124,496-82-8252
619,cchesswash6,"[{},{},{},{},{}]",142-989-4981,Sed accumsan felis. Ut at dolor quis odio consequat varius.,cchesswash6@blogspot.com,Carlin Chesswas,308-668-8334,492-92-7888
620,msurmeyerh7,"[{},{},{},{}]",949-493-9693,In hac habitasse platea dictumst.,msurmeyerh7@opera.com,Mitzi Surmeyer,112-399-0827,229-47-6004
621,edeavinh8,"[{},{},{}]",121-448-0486,Nullam molestie nibh in lectus. Pellentesque at nulla.,edeavinh8@qq.com,Ekaterina Deavin,702-258-9283,619-99-9864
622,wyakebovitchh9,[],985-638-5587,In hac habitasse platea dictumst. Maecenas ut massa quis augue luctus tincidunt. Nulla mollis molestie lorem.,wyakebovitchh9@purevolume.com,Wendy Yakebovitch,973-276-4421,536-63-8297
623,pjankovicha,"[{},{}]",724-417-1343,Curabitur at ipsum ac tellus semper interdum. Mauris ullamcorper purus sit amet nulla.,pjankovicha@imdb.com,Pearce Jankovic,128-613-8088,202-80-1993
624,cmassingberdhb,"[{},{},{}]",390-439-0072,"Morbi porttitor lorem id ligula. Suspendisse ornare consequat lectus. In est risus, auctor sed, tristique in, tempus sit amet, sem.",cmassingberdhb@ucoz.com,Creigh Massingberd,864-272-1774,440-48-3847
625,mpetrollohc,"[{},{}]",495-712-9324,Nulla facilisi.,mpetrollohc@odnoklassniki.ru,Mead Petrollo,976-969-7292,132-63-4863
626,slampetthd,"[{},{},{},{}]",803-710-2984,"Vestibulum ante ipsum primis in faucibus orci luctus et ultrices posuere cubilia Curae; Donec pharetra, magna vestibulum aliquet ultrices, erat tortor sollicitudin mi, sit amet lobortis sapien sapien non mi.",slampetthd@jugem.jp,Sonni Lampett,225-857-5297,112-29-8325
627,sclemonhe,"[{},{},{},{},{}]",141-209-5826,Aenean lectus. Pellentesque eget nunc. Donec quis orci eget orci vehicula condimentum.,sclemonhe@archive.org,Sabina Clemon,202-467-7777,549-31-2745
628,tvickermanhf,[],206-136-0501,Duis consequat dui nec nisi volutpat eleifend.,tvickermanhf@homestead.com,Truman Vickerman,295-954-0138,102-94-0600
629,gborastonhg,"[{},{},{}]",511-234-2727,"Nulla neque libero, convallis eget, eleifend luctus, ultricies eu, nibh.",gborastonhg@miibeian.gov.cn,Giusto Boraston,166-218-8393,736-12-4283
630,odrysdalehh,[],760-829-5905,In hac habitasse platea dictumst.,odrysdalehh@msu.edu,Olly Drysdale,314-789-7894,143-89-3893
631,bwiffillhi,[],105-217-8793,Duis mattis egestas metus. Aenean fermentum.,bwiffillhi@house.gov,Barb Wiffill,463-626-9722,400-97-1549
632,djodrellehj,[{}],681-611-0325,"Proin at turpis a pede posuere nonummy. Integer non velit. Donec diam neque, vestibulum eget, vulputate ut, ultrices vel, augue.",djodrellehj@earthlink.net,Deanne Jodrelle,128-741-5204,151-06-4100
633,gtrustiehk,"[{},{},{},{}]",118-136-8198,Etiam justo. Etiam pretium iaculis justo.,gtrustiehk@hatena.ne.jp,Giles Trustie,154-421-3781,625-47-8011
634,mattersollhl,"[{},{},{},{}]",403-462-4848,Donec ut dolor.,mattersollhl@npr.org,Marin Attersoll,656-163-7348,438-99-6907
635,dparrhm,[],872-639-9234,Nulla suscipit ligula in lacus. Curabitur at ipsum ac tellus semper interdum. Mauris ullamcorper purus sit amet nulla.,dparrhm@weather.com,David Parr,238-992-9900,205-11-8793
636,bdearnleyhn,"[{},{},{}]",465-586-5648,"Integer non velit. Donec diam neque, vestibulum eget, vulputate ut, ultrices vel, augue.",bdearnleyhn@hud.gov,Benjamin Dearnley,386-873-9884,482-63-0013
637,pmuckloho,[{}],949-469-8375,Suspendisse potenti.,pmuckloho@gnu.org,Pierre Mucklo,574-707-3329,398-56-9746
638,amichinhp,"[{},{},{},{}]",358-982-3970,"Donec ut mauris eget massa tempor convallis. Nulla neque libero, convallis eget, eleifend luctus, ultricies eu, nibh.",amichinhp@printfriendly.com,Averil Michin,230-727-5888,803-45-8178
639,moubridgehq,"[{},{},{},{}]",473-621-8622,Curabitur in libero ut massa volutpat convallis.,moubridgehq@cdbaby.com,Marcelline Oubridge,333-332-5386,191-21-0266
640,mbombhr,[],679-168-0696,Maecenas pulvinar lobortis est. Phasellus sit amet erat.,mbombhr@spotify.com,Meridel Bomb,632-319-3760,647-72-9403
641,edeportehs,[{}],485-188-3391,Fusce consequat.,edeportehs@aboutads.info,Eulalie Deporte,393-748-8578,749-34-9755
642,frozzellht,"[{},{},{},{}]",458-583-6255,"Maecenas leo odio, condimentum id, luctus nec, molestie sed, justo.",frozzellht@arstechnica.com,Felike Rozzell,709-731-1449,411-16-2857
643,jwidduphu,"[{},{},{},{},{}]",896-769-4019,Morbi non quam nec dui luctus rutrum.,jwidduphu@spiegel.de,Julian Widdup,596-532-3527,200-13-1262
644,bpipworthhv,"[{},{},{},{},{}]",885-943-2912,Vestibulum rutrum rutrum neque. Aenean auctor gravida sem.,bpipworthhv@themeforest.net,Broddie Pipworth,422-835-4150,229-22-0237
645,soldenhw,"[{},{},{},{}]",969-456-9800,Aliquam erat volutpat.,soldenhw@weather.com,Skippie Olden,151-634-3507,531-50-9961
646,kmcquillinhx,"[{},{},{},{}]",629-467-9206,"Vivamus metus arcu, adipiscing molestie, hendrerit at, vulputate vitae, nisl. Aenean lectus.",kmcquillinhx@ezinearticles.com,Kenny McQuillin,329-926-8375,546-65-8648
647,fdavenhillhy,"[{},{}]",965-899-9421,"Morbi ut odio. Cras mi pede, malesuada in, imperdiet et, commodo vulputate, justo. In blandit ultrices enim.",fdavenhillhy@elegantthemes.com,Fayette Davenhill,758-293-7530,229-60-8265
648,ljerromhz,[{}],513-699-8588,Cras non velit nec nisi vulputate nonummy. Maecenas tincidunt lacus at velit.,ljerromhz@over-blog.com,Leonardo Jerrom,143-963-9580,607-86-3666
649,mstorriei0,"[{},{},{}]",457-613-0906,Nulla ut erat id mauris vulputate elementum. Nullam varius.,mstorriei0@joomla.org,Merna Storrie,317-590-8261,586-29-0333
650,spattlei1,"[{},{}]",424-146-0597,Nulla justo. Aliquam quis turpis eget elit sodales scelerisque.,spattlei1@de.vu,Shayla Pattle,276-667-3667,123-52-0755
651,bdei2,"[{},{},{},{},{}]",131-422-4818,Donec posuere metus vitae ipsum. Aliquam non mauris.,bdei2@diigo.com,Bennett De Antoni,940-174-8544,699-92-2942
652,rhubberti3,[],870-237-0986,Aliquam quis turpis eget elit sodales scelerisque.,rhubberti3@utexas.edu,Riobard Hubbert,913-416-8948,755-76-0675
653,pcamplejohni4,"[{},{},{}]",855-138-5394,"Vestibulum quam sapien, varius ut, blandit non, interdum in, ante. Vestibulum ante ipsum primis in faucibus orci luctus et ultrices posuere cubilia Curae; Duis faucibus accumsan odio.",pcamplejohni4@ocn.ne.jp,Pembroke Camplejohn,736-388-2441,162-51-8455
654,nwalteri5,"[{},{}]",101-772-9784,Suspendisse accumsan tortor quis turpis.,nwalteri5@ow.ly,Nestor Walter,263-722-2060,379-86-9975
655,rbaszkiewiczi6,"[{},{},{},{}]",979-138-5426,Aenean auctor gravida sem. Praesent id massa id nisl venenatis lacinia.,rbaszkiewiczi6@bigcartel.com,Rory Baszkiewicz,601-586-5136,782-46-4939
656,gmanisi7,[{}],774-172-0153,"Fusce lacus purus, aliquet at, feugiat non, pretium quis, lectus. Suspendisse potenti. In eleifend quam a odio.",gmanisi7@nhs.uk,Gard Manis,241-659-4413,762-69-3059
657,ldiaperi8,[],111-183-8066,"Lorem ipsum dolor sit amet, consectetuer adipiscing elit. Proin interdum mauris non ligula pellentesque ultrices. Phasellus id sapien in sapien iaculis congue.",ldiaperi8@imgur.com,Laurence Diaper,687-839-9705,527-79-1328
658,rjeanneneti9,"[{},{},{},{}]",702-521-1442,Proin interdum mauris non ligula pellentesque ultrices. Phasellus id sapien in sapien iaculis congue.,rjeanneneti9@imageshack.us,Ralf Jeannenet,471-342-5359,349-96-2959
659,dmouseria,[{}],373-381-7547,Duis consequat dui nec nisi volutpat eleifend.,dmouseria@princeton.edu,Donal Mouser,223-978-6788,400-79-5013
660,cbedsonib,"[{},{}]",370-925-9169,"Vestibulum ante ipsum primis in faucibus orci luctus et ultrices posuere cubilia Curae; Donec pharetra, magna vestibulum aliquet ultrices, erat tortor sollicitudin mi, sit amet lobortis sapien sapien non mi. Integer ac neque.",cbedsonib@omniture.com,Crista Bedson,696-636-6487,890-20-9865
661,jdericotic,"[{},{},{},{},{}]",878-322-6495,Curabitur convallis.,jdericotic@histats.com,Jules Dericot,378-470-8790,343-26-3383
662,rfranekid,"[{},{}]",890-185-1576,Integer ac neque.,rfranekid@ucla.edu,Ranice Franek,431-865-8793,793-10-1231
663,pogbourneie,"[{},{},{},{}]",869-173-5413,Duis bibendum. Morbi non quam nec dui luctus rutrum. Nulla tellus.,pogbourneie@economist.com,Pembroke Ogbourne,945-335-8811,192-51-0416
664,okillif,"[{},{},{},{},{}]",572-454-9143,"Integer pede justo, lacinia eget, tincidunt eget, tempus vel, pede. Morbi porttitor lorem id ligula.",okillif@bloglovin.com,Oliver Kill,618-773-1766,742-51-3109
665,dflexmanig,"[{},{},{}]",625-572-6394,"Duis bibendum, felis sed interdum venenatis, turpis enim blandit mi, in porttitor pede justo eu massa.",dflexmanig@symantec.com,Demetra Flexman,319-973-2084,438-90-6555
666,acaddensih,[{}],529-346-3743,Nullam molestie nibh in lectus. Pellentesque at nulla. Suspendisse potenti.,acaddensih@unc.edu,Aloisia Caddens,458-292-9931,132-66-1908
667,eobeyii,"[{},{}]",525-738-8233,Nulla tellus.,eobeyii@google.com,Elisabet Obey,912-377-0150,358-87-2262
668,wfeldhornij,[],333-519-8081,Nulla mollis molestie lorem. Quisque ut erat. Curabitur gravida nisi at nibh.,wfeldhornij@twitter.com,Willis Feldhorn,108-598-2318,723-68-8432
669,bfayik,"[{},{},{}]",780-653-8227,"Lorem ipsum dolor sit amet, consectetuer adipiscing elit.",bfayik@whitehouse.gov,Beth Fay,297-940-2014,299-87-7389
670,rwessellil,"[{},{},{}]",928-953-4260,Morbi porttitor lorem id ligula.,rwessellil@cdbaby.com,Rita Wessell,528-369-7441,708-09-7709
671,byewdallim,"[{},{},{},{}]",292-707-1365,"Cras mi pede, malesuada in, imperdiet et, commodo vulputate, justo. In blandit ultrices enim. Lorem ipsum dolor sit amet, consectetuer adipiscing elit.",byewdallim@goo.gl,Bud Yewdall,624-157-3968,183-32-9300
672,zlemariein,"[{},{},{}]",874-752-7579,"Cum sociis natoque penatibus et magnis dis parturient montes, nascetur ridiculus mus. Vivamus vestibulum sagittis sapien. Cum sociis natoque penatibus et magnis dis parturient montes, nascetur ridiculus mus.",zlemariein@pagesperso-orange.fr,Zonnya Lemarie,421-692-1816,656-52-0250
673,bepelettio,"[{},{},{}]",106-873-6082,Morbi non quam nec dui luctus rutrum. Nulla tellus. In sagittis dui vel nisl.,bepelettio@youtu.be,Bale Epelett,503-913-0480,123-36-8355
674,hbroddleip,"[{},{},{}]",192-351-7335,Donec semper sapien a libero. Nam dui.,hbroddleip@comcast.net,Helaina Broddle,203-171-4340,798-09-0184
675,aleitcheiq,"[{},{},{},{},{}]",137-621-8689,Maecenas pulvinar lobortis est. Phasellus sit amet erat.,aleitcheiq@yahoo.co.jp,Anna-diane Leitche,869-244-9311,186-39-6514
676,rshimukir,[],109-516-4017,Donec dapibus. Duis at velit eu est congue elementum.,rshimukir@wix.com,Row Shimuk,518-915-7103,395-17-5076
677,vdewhurstis,[{}],521-207-2685,Nulla justo.,vdewhurstis@fc2.com,Violante Dewhurst,205-574-5830,450-79-7149
678,ncomussoit,"[{},{},{},{}]",739-568-0991,"Phasellus id sapien in sapien iaculis congue. Vivamus metus arcu, adipiscing molestie, hendrerit at, vulputate vitae, nisl. Aenean lectus.",ncomussoit@163.com,Novelia Comusso,500-191-5886,647-74-4523
679,tvaniu,[],457-883-1510,Cras non velit nec nisi vulputate nonummy. Maecenas tincidunt lacus at velit. Vivamus vel nulla eget eros elementum pellentesque.,tvaniu@flickr.com,Ted Van Velden,513-202-1376,347-16-0386
680,trogetiv,[],768-709-0455,Vestibulum sed magna at nunc commodo placerat. Praesent blandit. Nam nulla.,trogetiv@arstechnica.com,Tyler Roget,624-668-8973,733-04-0637
681,tetoniw,[],457-245-5462,Duis at velit eu est congue elementum. In hac habitasse platea dictumst.,tetoniw@tamu.edu,Thea Eton,209-308-9124,764-72-2665
682,rveitchix,"[{},{}]",558-225-0753,Aliquam non mauris. Morbi non lectus. Aliquam sit amet diam in magna bibendum imperdiet.,rveitchix@mysql.com,Reinald Veitch,391-254-3905,645-38-8990
683,twhitlawiy,"[{},{},{}]",217-537-0833,Duis consequat dui nec nisi volutpat eleifend.,twhitlawiy@comsenz.com,Terrence Whitlaw,837-882-5822,640-97-8465
684,bdelwateriz,[],612-143-2051,"Donec diam neque, vestibulum eget, vulputate ut, ultrices vel, augue. Vestibulum ante ipsum primis in faucibus orci luctus et ultrices posuere cubilia Curae; Donec pharetra, magna vestibulum aliquet ultrices, erat tortor sollicitudin mi, sit amet lobortis sapien sapien non mi. Integer ac neque.",bdelwateriz@ifeng.com,Brigit Delwater,984-443-7900,151-42-8438
685,wpinkj0,[{}],769-346-0280,"Donec ut mauris eget massa tempor convallis. Nulla neque libero, convallis eget, eleifend luctus, ultricies eu, nibh.",wpinkj0@bbb.org,Wilfred Pink,926-780-9800,708-90-6898
686,egermanj1,[{}],491-389-8836,"Quisque porta volutpat erat. Quisque erat eros, viverra eget, congue eget, semper rutrum, nulla.",egermanj1@posterous.com,Esma German,726-228-2959,234-29-4827
687,nfayrej2,"[{},{},{},{},{}]",305-903-3161,"Praesent blandit. Nam nulla. Integer pede justo, lacinia eget, tincidunt eget, tempus vel, pede.",nfayrej2@dropbox.com,Norman Fayre,332-821-3715,156-29-6129
688,gionj3,[],924-371-5052,"Mauris ullamcorper purus sit amet nulla. Quisque arcu libero, rutrum ac, lobortis vel, dapibus at, diam. Nam tristique tortor eu pede.",gionj3@1688.com,Gillan Ion,671-778-6773,732-95-9033
689,zmammattj4,"[{},{}]",593-847-6743,Sed ante. Vivamus tortor. Duis mattis egestas metus.,zmammattj4@google.com,Zebedee Mammatt,467-281-0650,707-66-3368
690,rkirsopj5,"[{},{}]",740-239-3016,"Cum sociis natoque penatibus et magnis dis parturient montes, nascetur ridiculus mus. Etiam vel augue.",rkirsopj5@newyorker.com,Rochette Kirsop,290-310-3759,350-42-4652
691,mwalworchej6,"[{},{},{},{},{}]",584-240-5505,"Fusce congue, diam id ornare imperdiet, sapien urna pretium nisl, ut volutpat sapien arcu sed augue.",mwalworchej6@theglobeandmail.com,Mariska Walworche,848-693-4531,451-51-2631
692,msecretanj7,"[{},{}]",378-943-9363,"Nulla ac enim. In tempor, turpis nec euismod scelerisque, quam turpis adipiscing lorem, vitae mattis nibh ligula nec sem. Duis aliquam convallis nunc.",msecretanj7@chronoengine.com,Marylee Secretan,535-536-5579,876-80-4209
693,wvarneyj8,"[{},{},{},{}]",390-145-0484,"Donec semper sapien a libero. Nam dui. Proin leo odio, porttitor id, consequat in, consequat ut, nulla.",wvarneyj8@businesswire.com,Winfred Varney,304-355-4587,275-28-8995
694,bbrookhousej9,[],211-800-9440,"Fusce congue, diam id ornare imperdiet, sapien urna pretium nisl, ut volutpat sapien arcu sed augue.",bbrookhousej9@networksolutions.com,Blanch Brookhouse,249-218-6155,849-36-8597
695,oabotsonja,"[{},{}]",160-551-7788,Morbi non quam nec dui luctus rutrum.,oabotsonja@macromedia.com,Obie Abotson,297-263-4093,362-12-4502
696,sratchfordjb,[{}],216-898-9555,Morbi a ipsum. Integer a nibh. In quis justo.,sratchfordjb@chicagotribune.com,Sandra Ratchford,171-259-9237,634-08-8549
697,dwalshjc,"[{},{},{}]",782-537-3238,"Cras in purus eu magna vulputate luctus. Cum sociis natoque penatibus et magnis dis parturient montes, nascetur ridiculus mus.",dwalshjc@census.gov,Delcine Walsh,348-705-4316,316-02-8395
