id,username,user_preferences,contact_number,user_bio,email_sensitive,full_name_sensitive,phone_number_sensitive,ssn_sensitive
1,fstonner0,[],190-719-5772,"Cras pellentesque volutpat dui. Maecenas tristique, est et tempus semper, est quam pharetra magna, ac consequat metus sapien ut nunc. Vestibulum ante ipsum primis in faucibus orci luctus et ultrices posuere cubilia Curae; Mauris viverra diam vitae quam.",fstonner0@omniture.com,Filide Stonner,646-124-5939,195-03-1753
2,acronin1,"[{},{},{}]",417-444-6329,"Vestibulum ante ipsum primis in faucibus orci luctus et ultrices posuere cubilia Curae; Donec pharetra, magna vestibulum aliquet ultrices, erat tortor sollicitudin mi, sit amet lobortis sapien sapien non mi.",acronin1@aboutads.info,Adele Cronin,249-810-5487,203-21-9178
3,dprozescky2,"[{},{},{},{},{}]",837-277-9549,Suspendisse potenti. Cras in purus eu magna vulputate luctus.,dprozescky2@myspace.com,Delilah Prozescky,357-898-8134,553-74-0203
4,aschwant3,"[{},{}]",917-519-7126,Integer a nibh. In quis justo.,aschwant3@google.co.jp,Ario Schwant,526-120-2623,681-26-7637
5,lspillard4,"[{},{},{},{},{}]",317-551-1510,Nunc purus.,lspillard4@feedburner.com,Leigh Spillard,202-749-5148,861-56-8129
6,vkinnear5,"[{},{},{}]",718-840-8360,Nulla mollis molestie lorem. Quisque ut erat.,vkinnear5@hibu.com,Vere Kinnear,705-894-0229,352-52-7931
7,estrowger6,"[{},{},{}]",627-991-5213,Pellentesque viverra pede ac diam.,estrowger6@bigcartel.com,Ernst Strowger,839-181-3517,544-76-3510
8,wsobieski7,[],848-268-3601,Praesent blandit. Nam nulla.,wsobieski7@gizmodo.com,Wally Sobieski,630-221-8729,820-37-6783
9,jhalpeine8,"[{},{},{},{},{}]",713-662-6975,Pellentesque viverra pede ac diam.,jhalpeine8@w3.org,Judas Halpeine,738-459-8491,108-66-9584
10,hfrape9,[],865-934-3202,Etiam vel augue. Vestibulum rutrum rutrum neque. Aenean auctor gravida sem.,hfrape9@mail.ru,Hollie Frape,665-724-2652,379-85-7775
11,cmiddena,"[{},{},{},{}]",369-545-0628,Curabitur at ipsum ac tellus semper interdum. Mauris ullamcorper purus sit amet nulla.,cmiddena@addtoany.com,Cher Midden,267-880-6149,220-62-9746
12,dbrundellb,"[{},{},{}]",916-283-8920,"Vestibulum ante ipsum primis in faucibus orci luctus et ultrices posuere cubilia Curae; Nulla dapibus dolor vel est. Donec odio justo, sollicitudin ut, suscipit a, feugiat et, eros.",dbrundellb@360.cn,Dorena Brundell,348-529-9544,590-68-5246
13,adalglieshc,"[{},{},{}]",104-489-2571,"Aliquam augue quam, sollicitudin vitae, consectetuer eget, rutrum at, lorem. Integer tincidunt ante vel ipsum.",adalglieshc@moonfruit.com,Anatole Dalgliesh,424-462-9698,385-12-0434
14,dfancourtd,"[{},{},{},{}]",347-786-3721,Phasellus id sapien in sapien iaculis congue.,dfancourtd@constantcontact.com,Dani Fancourt,731-873-3177,221-63-3351
15,nlanderse,"[{},{},{},{},{}]",894-709-5357,"Donec vitae nisi. Nam ultrices, libero non mattis pulvinar, nulla pede ullamcorper augue, a suscipit nulla elit ac nulla. Sed vel enim sit amet nunc viverra dapibus.",nlanderse@slate.com,Nathanial Landers,506-618-3944,314-68-1958
16,kferyf,"[{},{},{},{}]",912-769-0373,Praesent id massa id nisl venenatis lacinia. Aenean sit amet justo. Morbi ut odio.,kferyf@amazonaws.com,Kory Fery,809-959-3135,482-69-4357
17,adillewayg,[{}],679-840-8491,Proin interdum mauris non ligula pellentesque ultrices.,adillewayg@chron.com,Adi Dilleway,141-595-0115,191-05-6272
18,ctyerh,[{}],839-547-6469,Nulla nisl. Nunc nisl.,ctyerh@ibm.com,Cammie Tyer,785-503-4227,190-11-7051
19,fstennardi,"[{},{},{}]",862-978-9781,"Pellentesque viverra pede ac diam. Cras pellentesque volutpat dui. Maecenas tristique, est et tempus semper, est quam pharetra magna, ac consequat metus sapien ut nunc.",fstennardi@vistaprint.com,Fawne Stennard,695-183-3889,200-13-9918
20,schantreej,[{}],102-502-9171,Vestibulum sed magna at nunc commodo placerat.,schantreej@bbb.org,Sally Chantree,591-778-3486,870-45-5181
21,anoonek,[],421-955-4527,"Quisque erat eros, viverra eget, congue eget, semper rutrum, nulla.",anoonek@wiley.com,Alonso Noone,304-845-3231,208-96-6153
22,scarpmilel,[],997-948-2464,"Nulla ac enim. In tempor, turpis nec euismod scelerisque, quam turpis adipiscing lorem, vitae mattis nibh ligula nec sem.",scarpmilel@time.com,Sonnnie Carpmile,344-633-4710,738-96-0192
23,gduferiem,[],395-242-4428,Nunc rhoncus dui vel sem. Sed sagittis.,gduferiem@canalblog.com,Gifford Duferie,259-883-8254,816-53-0247
24,rchadbandn,"[{},{},{},{},{}]",446-134-9049,"Cras mi pede, malesuada in, imperdiet et, commodo vulputate, justo. In blandit ultrices enim.",rchadbandn@elpais.com,Ray Chadband,823-549-8378,795-02-3865
25,kdenerso,[],303-766-6217,Aenean lectus. Pellentesque eget nunc.,kdenerso@wordpress.org,Kinsley Deners,131-379-6688,178-71-6150
26,lmcgallp,"[{},{},{},{}]",322-653-2240,Duis consequat dui nec nisi volutpat eleifend. Donec ut dolor. Morbi vel lectus in quam fringilla rhoncus.,lmcgallp@cloudflare.com,Luce McGall,861-279-5083,563-94-1480
27,mleifq,"[{},{},{},{},{}]",600-107-2986,Duis aliquam convallis nunc. Proin at turpis a pede posuere nonummy.,mleifq@ask.com,Marita Leif,426-530-3036,550-77-9283
28,eimmsr,[],489-810-6390,"In blandit ultrices enim. Lorem ipsum dolor sit amet, consectetuer adipiscing elit.",eimmsr@geocities.com,Edward Imms,294-799-9118,785-47-3181
29,rperringtons,"[{},{},{},{}]",760-933-7880,"Nam nulla. Integer pede justo, lacinia eget, tincidunt eget, tempus vel, pede. Morbi porttitor lorem id ligula.",rperringtons@vimeo.com,Roda Perrington,564-663-3904,808-40-5518
30,mclewst,"[{},{},{}]",760-873-4855,Maecenas pulvinar lobortis est. Phasellus sit amet erat. Nulla tempus.,mclewst@plala.or.jp,Merv Clews,772-634-3086,515-39-8022
31,wschildu,"[{},{},{},{}]",934-287-9071,"Duis bibendum, felis sed interdum venenatis, turpis enim blandit mi, in porttitor pede justo eu massa. Donec dapibus. Duis at velit eu est congue elementum.",wschildu@kickstarter.com,Willa Schild,140-414-9779,528-52-7251
32,thovev,[],205-188-6393,Curabitur convallis. Duis consequat dui nec nisi volutpat eleifend.,thovev@elegantthemes.com,Tate Hove,437-795-3774,658-62-6881
33,mbrokew,[{}],269-915-1944,"Suspendisse potenti. Cras in purus eu magna vulputate luctus. Cum sociis natoque penatibus et magnis dis parturient montes, nascetur ridiculus mus.",mbrokew@macromedia.com,Mandel Broke,884-633-6287,846-34-5310
34,kgoldisx,[{}],829-150-4519,Morbi quis tortor id nulla ultrices aliquet.,kgoldisx@usnews.com,Korey Goldis,643-477-1745,197-56-4405
35,emaestriniy,"[{},{},{},{}]",946-161-4834,Suspendisse potenti. In eleifend quam a odio.,emaestriniy@gmpg.org,Evangelia Maestrini,526-886-4169,510-14-8217
36,mbrannonz,"[{},{},{},{},{}]",236-951-9041,Etiam vel augue. Vestibulum rutrum rutrum neque. Aenean auctor gravida sem.,mbrannonz@jalbum.net,Martina Brannon,963-231-6520,614-57-4977
37,tlocock10,[{}],401-922-6536,"In tempor, turpis nec euismod scelerisque, quam turpis adipiscing lorem, vitae mattis nibh ligula nec sem. Duis aliquam convallis nunc.",tlocock10@indiatimes.com,Truda Locock,516-175-2678,254-09-1448
38,docaine11,[{}],680-784-6292,"Praesent lectus. Vestibulum quam sapien, varius ut, blandit non, interdum in, ante.",docaine11@blogtalkradio.com,Daisie O'Caine,443-871-5700,651-61-8627
39,gredwing12,"[{},{},{},{},{}]",508-821-5185,Etiam vel augue.,gredwing12@eventbrite.com,Gwenore Redwing,250-911-7549,308-90-3829
40,mhuyton13,"[{},{},{},{}]",335-251-3770,In sagittis dui vel nisl. Duis ac nibh.,mhuyton13@quantcast.com,Meridith Huyton,103-916-1180,728-66-2328
41,mpopple14,"[{},{},{},{}]",172-483-8616,Vestibulum ante ipsum primis in faucibus orci luctus et ultrices posuere cubilia Curae; Mauris viverra diam vitae quam. Suspendisse potenti.,mpopple14@soup.io,Modestine Popple,588-417-7817,300-90-0005
42,lcampsall15,"[{},{},{}]",410-395-1490,"Vestibulum ac est lacinia nisi venenatis tristique. Fusce congue, diam id ornare imperdiet, sapien urna pretium nisl, ut volutpat sapien arcu sed augue. Aliquam erat volutpat.",lcampsall15@freewebs.com,Lock Campsall,695-634-0593,509-96-2523
43,wmonini16,"[{},{},{},{}]",754-651-2889,Pellentesque ultrices mattis odio. Donec vitae nisi.,wmonini16@google.it,Wrennie Monini,150-725-6621,889-72-8074
44,mandrelli17,[],581-273-0121,Donec dapibus. Duis at velit eu est congue elementum. In hac habitasse platea dictumst.,mandrelli17@unicef.org,Margit Andrelli,587-192-4032,496-78-5985
45,pbartens18,[{}],262-322-6064,"Nam nulla. Integer pede justo, lacinia eget, tincidunt eget, tempus vel, pede.",pbartens18@noaa.gov,Pavla Bartens,983-600-6079,671-32-2510
46,gbatterson19,"[{},{},{},{},{}]",988-273-3364,"Phasellus id sapien in sapien iaculis congue. Vivamus metus arcu, adipiscing molestie, hendrerit at, vulputate vitae, nisl. Aenean lectus.",gbatterson19@tripadvisor.com,Gertrud Batterson,313-354-1020,658-80-8864
47,kde1a,[{}],674-582-0816,"Fusce lacus purus, aliquet at, feugiat non, pretium quis, lectus. Suspendisse potenti. In eleifend quam a odio.",kde1a@taobao.com,Keslie De Stoop,210-938-1957,186-77-1708
48,jwinspar1b,[],763-934-2745,"Fusce congue, diam id ornare imperdiet, sapien urna pretium nisl, ut volutpat sapien arcu sed augue. Aliquam erat volutpat. In congue.",jwinspar1b@loc.gov,Jarvis Winspar,480-697-4721,224-50-8635
49,dsamsworth1c,"[{},{}]",857-100-5011,Duis bibendum.,dsamsworth1c@com.com,Devina Samsworth,176-324-5572,804-52-2249
50,mdavenall1d,"[{},{},{},{}]",209-817-0778,"Fusce congue, diam id ornare imperdiet, sapien urna pretium nisl, ut volutpat sapien arcu sed augue.",mdavenall1d@uol.com.br,Monica Davenall,736-723-4571,335-39-8737
51,ibeange1e,"[{},{},{}]",416-866-8382,"Pellentesque ultrices mattis odio. Donec vitae nisi. Nam ultrices, libero non mattis pulvinar, nulla pede ullamcorper augue, a suscipit nulla elit ac nulla.",ibeange1e@xrea.com,Isacco Beange,891-763-5896,618-25-4939
52,ahucker1f,[],693-187-2846,Aliquam quis turpis eget elit sodales scelerisque. Mauris sit amet eros.,ahucker1f@biglobe.ne.jp,Annabal Hucker,390-983-1439,621-47-9256
53,olearie1g,[{}],191-313-5077,Ut tellus.,olearie1g@vkontakte.ru,Oliver Learie,944-653-3832,850-05-8730
54,ptorvey1h,"[{},{}]",316-933-4239,Ut at dolor quis odio consequat varius.,ptorvey1h@ifeng.com,Petronilla Torvey,423-507-4350,788-50-8048
55,lvel1i,"[{},{}]",468-457-2341,"Curabitur at ipsum ac tellus semper interdum. Mauris ullamcorper purus sit amet nulla. Quisque arcu libero, rutrum ac, lobortis vel, dapibus at, diam.",lvel1i@lycos.com,Libby Vel,492-842-0233,293-87-5650
56,mweekes1j,"[{},{},{}]",621-325-2646,"Nullam orci pede, venenatis non, sodales sed, tincidunt eu, felis. Fusce posuere felis sed lacus. Morbi sem mauris, laoreet ut, rhoncus aliquet, pulvinar sed, nisl.",mweekes1j@marketwatch.com,Marcia Weekes,353-671-3513,822-26-1269
57,zberkeley1k,"[{},{},{}]",999-168-2713,Sed vel enim sit amet nunc viverra dapibus. Nulla suscipit ligula in lacus. Curabitur at ipsum ac tellus semper interdum.,zberkeley1k@independent.co.uk,Zebadiah Berkeley,178-196-5592,237-44-8077
58,mbalazin1l,"[{},{},{}]",588-799-5451,In eleifend quam a odio.,mbalazin1l@ihg.com,Marley Balazin,322-656-0343,173-38-7001
59,mhark1m,"[{},{}]",947-951-9772,Donec quis orci eget orci vehicula condimentum.,mhark1m@zdnet.com,Meg Hark,673-291-7439,664-48-9636
60,gbenning1n,[{}],400-696-9466,"Aliquam augue quam, sollicitudin vitae, consectetuer eget, rutrum at, lorem. Integer tincidunt ante vel ipsum.",gbenning1n@japanpost.jp,Gideon Benning,906-942-1107,561-60-8837
61,cparell1o,"[{},{}]",236-107-0459,Aliquam quis turpis eget elit sodales scelerisque. Mauris sit amet eros.,cparell1o@examiner.com,Collette Parell,845-795-8511,614-30-5986
62,nfairbank1p,"[{},{},{},{}]",638-842-7272,Morbi quis tortor id nulla ultrices aliquet.,nfairbank1p@un.org,Nikolaus Fairbank,801-243-4912,623-36-9425
63,black1q,[{}],760-930-0716,Sed accumsan felis. Ut at dolor quis odio consequat varius. Integer ac leo.,black1q@reuters.com,Briny Lack,903-310-5760,855-82-8965
64,ahalls1r,[{}],997-421-3472,In quis justo. Maecenas rhoncus aliquam lacus.,ahalls1r@europa.eu,Abdel Halls,616-140-8820,864-29-4597
65,jkilliam1s,"[{},{},{},{}]",802-787-1957,Nullam varius.,jkilliam1s@livejournal.com,Jandy Killiam,235-859-7708,592-95-3543
66,ebroker1t,"[{},{},{},{},{}]",961-249-8233,Duis aliquam convallis nunc.,ebroker1t@yahoo.co.jp,Emmey Broker,677-331-2727,163-41-0835
67,neastbrook1u,[{}],650-243-6509,"Donec odio justo, sollicitudin ut, suscipit a, feugiat et, eros. Vestibulum ac est lacinia nisi venenatis tristique.",neastbrook1u@clickbank.net,Neddy Eastbrook,939-275-1659,216-50-9902
68,astolz1v,[],210-938-8433,"Duis ac nibh. Fusce lacus purus, aliquet at, feugiat non, pretium quis, lectus.",astolz1v@amazon.co.uk,Alexa Stolz,410-261-4673,411-02-1779
69,vhullah1w,"[{},{},{},{}]",227-643-3350,"Curabitur gravida nisi at nibh. In hac habitasse platea dictumst. Aliquam augue quam, sollicitudin vitae, consectetuer eget, rutrum at, lorem.",vhullah1w@sogou.com,Valle Hullah,225-270-8661,782-28-4716
70,gluckin1x,[{}],839-759-5938,"Nulla nisl. Nunc nisl. Duis bibendum, felis sed interdum venenatis, turpis enim blandit mi, in porttitor pede justo eu massa.",gluckin1x@moonfruit.com,Gennifer Luckin,757-826-5847,659-51-6846
71,kcosgriff1y,"[{},{},{}]",664-732-5189,Suspendisse accumsan tortor quis turpis. Sed ante.,kcosgriff1y@dion.ne.jp,Korry Cosgriff,981-946-6749,711-67-0442
72,rkynnd1z,[{}],465-943-7877,Nulla tellus.,rkynnd1z@foxnews.com,Roseanna Kynnd,224-916-0252,817-78-4517
73,mskae20,[{}],723-173-6593,Curabitur gravida nisi at nibh. In hac habitasse platea dictumst.,mskae20@google.com.hk,Marcelline Skae,162-896-9532,688-40-2465
74,bkilty21,"[{},{},{}]",225-708-5453,Aenean sit amet justo. Morbi ut odio.,bkilty21@shutterfly.com,Benoit Kilty,243-351-3755,111-01-4573
75,jjohansen22,[{}],227-728-3266,Curabitur gravida nisi at nibh.,jjohansen22@msu.edu,Jamil Johansen,535-254-9825,743-15-9291
76,zzsa23,"[{},{},{},{},{}]",165-567-0607,"Morbi vel lectus in quam fringilla rhoncus. Mauris enim leo, rhoncus sed, vestibulum sit amet, cursus id, turpis.",zzsa23@scribd.com,Zsa zsa Veevers,258-299-1025,647-61-1108
77,thaspineall24,"[{},{},{}]",296-779-1293,In quis justo. Maecenas rhoncus aliquam lacus. Morbi quis tortor id nulla ultrices aliquet.,thaspineall24@trellian.com,Tory Haspineall,465-299-6236,601-05-1565
78,gsuch25,[],648-144-5615,Aenean lectus. Pellentesque eget nunc.,gsuch25@earthlink.net,Godard Such,217-421-8323,152-16-4670
79,bverring26,[],299-653-4296,"Nullam orci pede, venenatis non, sodales sed, tincidunt eu, felis. Fusce posuere felis sed lacus. Morbi sem mauris, laoreet ut, rhoncus aliquet, pulvinar sed, nisl.",bverring26@uiuc.edu,Bobby Verring,668-987-2673,481-29-8050
80,gbellam27,[{}],598-679-5805,Nunc rhoncus dui vel sem. Sed sagittis.,gbellam27@canalblog.com,Guinevere Bellam,619-359-7557,458-28-0559
81,jbranney28,"[{},{},{},{},{}]",567-538-5077,Quisque id justo sit amet sapien dignissim vestibulum.,jbranney28@deviantart.com,Janot Branney,121-417-3690,833-46-6284
82,apriditt29,[],232-314-1545,Quisque id justo sit amet sapien dignissim vestibulum.,apriditt29@creativecommons.org,Arleen Priditt,855-534-9277,786-27-7094
83,senriquez2a,[],883-738-2537,"Quisque arcu libero, rutrum ac, lobortis vel, dapibus at, diam. Nam tristique tortor eu pede.",senriquez2a@nsw.gov.au,Susanna Enriquez,231-381-1689,465-58-6298
84,plillicrap2b,"[{},{},{},{},{}]",188-660-7473,"Vestibulum ante ipsum primis in faucibus orci luctus et ultrices posuere cubilia Curae; Donec pharetra, magna vestibulum aliquet ultrices, erat tortor sollicitudin mi, sit amet lobortis sapien sapien non mi. Integer ac neque. Duis bibendum.",plillicrap2b@myspace.com,Phillida Lillicrap,652-605-5836,508-72-1996
85,dkrelle2c,"[{},{},{}]",707-552-3098,In hac habitasse platea dictumst.,dkrelle2c@de.vu,Dido Krelle,206-902-4795,355-84-3311
86,rmynott2d,"[{},{},{}]",669-842-4098,"Pellentesque viverra pede ac diam. Cras pellentesque volutpat dui. Maecenas tristique, est et tempus semper, est quam pharetra magna, ac consequat metus sapien ut nunc.",rmynott2d@wunderground.com,Rosaline Mynott,404-168-1367,608-28-3588
87,ioxlade2e,"[{},{}]",834-537-7210,Proin risus. Praesent lectus.,ioxlade2e@hubpages.com,Ignacius Oxlade,314-484-4041,455-97-9981
88,maspinal2f,[],100-616-7879,"Pellentesque ultrices mattis odio. Donec vitae nisi. Nam ultrices, libero non mattis pulvinar, nulla pede ullamcorper augue, a suscipit nulla elit ac nulla.",maspinal2f@apache.org,Michel Aspinal,413-940-4652,678-45-3222
89,lswainston2g,[],564-674-6486,"Morbi porttitor lorem id ligula. Suspendisse ornare consequat lectus. In est risus, auctor sed, tristique in, tempus sit amet, sem.",lswainston2g@nih.gov,Lindi Swainston,897-888-8555,697-59-0136
90,mhixson2h,[],706-736-6498,"Donec diam neque, vestibulum eget, vulputate ut, ultrices vel, augue. Vestibulum ante ipsum primis in faucibus orci luctus et ultrices posuere cubilia Curae; Donec pharetra, magna vestibulum aliquet ultrices, erat tortor sollicitudin mi, sit amet lobortis sapien sapien non mi.",mhixson2h@earthlink.net,Malina Hixson,561-316-3679,661-30-9103
91,jrasher2i,"[{},{}]",503-697-0404,In eleifend quam a odio. In hac habitasse platea dictumst.,jrasher2i@yandex.ru,Jeramey Rasher,364-149-9249,141-36-3352
92,cbuddock2j,"[{},{}]",284-751-8909,"In tempor, turpis nec euismod scelerisque, quam turpis adipiscing lorem, vitae mattis nibh ligula nec sem. Duis aliquam convallis nunc. Proin at turpis a pede posuere nonummy.",cbuddock2j@usa.gov,Culver Buddock,422-736-0386,821-11-3341
93,jricharson2k,[{}],745-221-3988,"Nunc rhoncus dui vel sem. Sed sagittis. Nam congue, risus semper porta volutpat, quam pede lobortis ligula, sit amet eleifend pede libero quis orci.",jricharson2k@smugmug.com,June Richarson,416-951-3740,383-66-7451
94,gschall2l,"[{},{},{}]",434-399-6256,In blandit ultrices enim.,gschall2l@opera.com,Guido Schall,937-837-1080,405-68-1341
95,hburberry2m,"[{},{},{},{}]",488-956-6028,In sagittis dui vel nisl.,hburberry2m@imdb.com,Hilliard Burberry,804-280-5706,744-68-3871
96,abaskeyfield2n,"[{},{},{},{},{}]",339-122-4184,Mauris lacinia sapien quis libero. Nullam sit amet turpis elementum ligula vehicula consequat.,abaskeyfield2n@gmpg.org,Anabal Baskeyfield,320-717-5336,854-51-7013
97,jpetyt2o,[],457-511-9544,"Donec vitae nisi. Nam ultrices, libero non mattis pulvinar, nulla pede ullamcorper augue, a suscipit nulla elit ac nulla. Sed vel enim sit amet nunc viverra dapibus.",jpetyt2o@pagesperso-orange.fr,Jason Petyt,172-877-7304,101-31-2153
98,dandrysiak2p,[{}],470-960-8522,Mauris lacinia sapien quis libero. Nullam sit amet turpis elementum ligula vehicula consequat. Morbi a ipsum.,dandrysiak2p@elpais.com,Dmitri Andrysiak,842-283-6767,702-40-0784
99,bpeasnone2q,[{}],774-560-2112,"Fusce congue, diam id ornare imperdiet, sapien urna pretium nisl, ut volutpat sapien arcu sed augue. Aliquam erat volutpat.",bpeasnone2q@blogspot.com,Baryram Peasnone,307-500-5597,509-02-4434
100,afigura2r,[{}],653-827-5941,Etiam vel augue. Vestibulum rutrum rutrum neque.,afigura2r@vinaora.com,Arnie Figura,515-244-8179,222-95-2391
101,lbracer2s,[],443-991-1238,Aliquam sit amet diam in magna bibendum imperdiet.,lbracer2s@latimes.com,Levin Bracer,750-316-2311,648-35-9989
102,cshewen2t,"[{},{}]",470-949-6142,Aenean lectus.,cshewen2t@omniture.com,Constantine Shewen,152-378-6201,645-59-3498
103,tgolbourn2u,[],955-341-8903,Pellentesque viverra pede ac diam.,tgolbourn2u@arstechnica.com,Tildie Golbourn,840-536-7394,105-98-6746
104,rfaulder2v,"[{},{},{},{},{}]",810-397-8344,In hac habitasse platea dictumst. Maecenas ut massa quis augue luctus tincidunt.,rfaulder2v@w3.org,Randolph Faulder,972-396-6588,119-51-7303
105,tmartland2w,"[{},{},{}]",844-884-8614,Praesent blandit.,tmartland2w@histats.com,Tate Martland,609-571-2218,276-74-9825
106,mepperson2x,"[{},{},{},{},{}]",258-343-1237,Duis bibendum.,mepperson2x@shinystat.com,Mavis Epperson,989-397-4930,778-77-5551
107,kbrocklesby2y,"[{},{}]",993-202-8164,Vestibulum sed magna at nunc commodo placerat. Praesent blandit.,kbrocklesby2y@europa.eu,Keen Brocklesby,844-597-3335,414-70-2558
108,bbackshall2z,"[{},{},{},{},{}]",784-926-5059,"Vestibulum ante ipsum primis in faucibus orci luctus et ultrices posuere cubilia Curae; Donec pharetra, magna vestibulum aliquet ultrices, erat tortor sollicitudin mi, sit amet lobortis sapien sapien non mi. Integer ac neque. Duis bibendum.",bbackshall2z@last.fm,Babette Backshall,865-406-7810,298-75-4530
109,rkellard30,[],147-829-1349,"Suspendisse ornare consequat lectus. In est risus, auctor sed, tristique in, tempus sit amet, sem. Fusce consequat.",rkellard30@msu.edu,Raphaela Kellard,288-352-6866,472-83-0077
110,bclibbery31,"[{},{},{},{},{}]",192-651-4708,Morbi a ipsum. Integer a nibh. In quis justo.,bclibbery31@loc.gov,Brandy Clibbery,506-416-2045,744-13-8353
111,bglastonbury32,[{}],179-695-5188,Etiam faucibus cursus urna.,bglastonbury32@narod.ru,Britta Glastonbury,392-983-1993,748-87-3861
112,vhutten33,"[{},{},{},{},{}]",603-329-1346,Aliquam non mauris. Morbi non lectus. Aliquam sit amet diam in magna bibendum imperdiet.,vhutten33@yahoo.co.jp,Vivien Hutten,725-858-8420,112-78-8627
113,gmacourek34,"[{},{},{},{},{}]",937-962-3154,"Nullam orci pede, venenatis non, sodales sed, tincidunt eu, felis.",gmacourek34@issuu.com,Gardener Macourek,197-719-4360,744-23-7543
114,dhaysman35,[{}],809-203-9410,Vivamus in felis eu sapien cursus vestibulum.,dhaysman35@businessweek.com,Dillie Haysman,960-351-7836,778-64-7790
115,cellington36,[],901-632-0594,Nam tristique tortor eu pede.,cellington36@joomla.org,Chrissy Ellington,904-992-0483,398-87-3116
116,fmargetts37,"[{},{},{},{},{}]",884-903-7803,"Morbi sem mauris, laoreet ut, rhoncus aliquet, pulvinar sed, nisl. Nunc rhoncus dui vel sem.",fmargetts37@nature.com,Flinn Margetts,846-840-1187,592-60-0849
117,jwilflinger38,"[{},{}]",353-905-6893,"Aenean fermentum. Donec ut mauris eget massa tempor convallis. Nulla neque libero, convallis eget, eleifend luctus, ultricies eu, nibh.",jwilflinger38@topsy.com,Jaimie Wilflinger,788-332-9202,287-14-2146
118,mweddup39,"[{},{},{}]",962-325-8684,Nam nulla.,mweddup39@seesaa.net,Modesta Weddup,758-692-3662,780-73-0970
119,asherebrook3a,[],478-588-5830,"Vestibulum quam sapien, varius ut, blandit non, interdum in, ante. Vestibulum ante ipsum primis in faucibus orci luctus et ultrices posuere cubilia Curae; Duis faucibus accumsan odio. Curabitur convallis.",asherebrook3a@reference.com,Alvis Sherebrook,962-522-7247,485-27-1905
120,csotheron3b,"[{},{},{},{}]",912-974-2836,Integer ac leo. Pellentesque ultrices mattis odio.,csotheron3b@discuz.net,Cordula Sotheron,517-842-7565,707-61-4969
121,gphilipsson3c,"[{},{}]",194-928-7348,"Morbi vel lectus in quam fringilla rhoncus. Mauris enim leo, rhoncus sed, vestibulum sit amet, cursus id, turpis.",gphilipsson3c@nhs.uk,Gram Philipsson,654-821-2541,232-88-4213
122,hcicconetti3d,"[{},{},{}]",538-488-7646,"Proin eu mi. Nulla ac enim. In tempor, turpis nec euismod scelerisque, quam turpis adipiscing lorem, vitae mattis nibh ligula nec sem.",hcicconetti3d@phoca.cz,Hortense Cicconetti,499-580-7143,308-97-1212
123,dhamlington3e,[{}],859-534-0311,Praesent id massa id nisl venenatis lacinia.,dhamlington3e@meetup.com,Dunstan Hamlington,104-566-9257,461-83-0846
124,ebrocklesby3f,"[{},{}]",554-139-1678,Praesent lectus.,ebrocklesby3f@nsw.gov.au,Elliott Brocklesby,341-843-0088,827-88-0735
125,npurshouse3g,[],954-702-8264,Aenean auctor gravida sem. Praesent id massa id nisl venenatis lacinia. Aenean sit amet justo.,npurshouse3g@jigsy.com,Nelson Purshouse,606-220-3247,787-94-0273
126,cpassman3h,[],638-926-0455,"Morbi vestibulum, velit id pretium iaculis, diam erat fermentum justo, nec condimentum neque sapien placerat ante. Nulla justo. Aliquam quis turpis eget elit sodales scelerisque.",cpassman3h@nytimes.com,Carlynn Passman,547-596-0981,528-32-4977
127,ddaburn3i,"[{},{},{}]",761-376-4976,"Proin at turpis a pede posuere nonummy. Integer non velit. Donec diam neque, vestibulum eget, vulputate ut, ultrices vel, augue.",ddaburn3i@facebook.com,Dalia Daburn,128-316-7111,509-64-7806
128,tnapolitano3j,[],382-830-8191,Cras pellentesque volutpat dui.,tnapolitano3j@weather.com,Timothy Napolitano,214-178-3038,347-40-0153
129,oflowerdew3k,"[{},{}]",393-552-7090,"In hac habitasse platea dictumst. Morbi vestibulum, velit id pretium iaculis, diam erat fermentum justo, nec condimentum neque sapien placerat ante. Nulla justo.",oflowerdew3k@washington.edu,Ofilia Flowerdew,895-309-8258,881-78-5487
130,pbeadman3l,"[{},{},{},{},{}]",872-258-8665,Proin eu mi. Nulla ac enim.,pbeadman3l@w3.org,Phebe Beadman,590-588-9622,654-10-0020
131,ybaldcock3m,"[{},{}]",420-483-5993,Phasellus in felis.,ybaldcock3m@geocities.com,Yves Baldcock,552-632-4997,207-38-5568
132,nliggett3n,"[{},{},{}]",423-103-9508,"Nullam orci pede, venenatis non, sodales sed, tincidunt eu, felis. Fusce posuere felis sed lacus. Morbi sem mauris, laoreet ut, rhoncus aliquet, pulvinar sed, nisl.",nliggett3n@tamu.edu,Niel Liggett,638-438-6624,401-73-5919
133,klillywhite3o,[],571-817-5359,Integer ac leo. Pellentesque ultrices mattis odio.,klillywhite3o@fc2.com,Kori Lillywhite,203-714-9840,875-96-5762
134,ravon3p,[{}],258-687-6804,"Praesent lectus. Vestibulum quam sapien, varius ut, blandit non, interdum in, ante.",ravon3p@canalblog.com,Rene Avon,841-815-1412,305-82-5118
135,wtipton3q,"[{},{},{},{}]",695-446-8404,"Lorem ipsum dolor sit amet, consectetuer adipiscing elit. Proin interdum mauris non ligula pellentesque ultrices. Phasellus id sapien in sapien iaculis congue.",wtipton3q@blogtalkradio.com,Whittaker Tipton,532-612-0939,104-17-0954
136,mimpy3r,[],352-595-5858,"Duis bibendum, felis sed interdum venenatis, turpis enim blandit mi, in porttitor pede justo eu massa.",mimpy3r@businesswire.com,Mose Impy,430-580-8011,687-02-7600
137,jsaich3s,"[{},{}]",254-419-5361,Suspendisse potenti. Nullam porttitor lacus at turpis. Donec posuere metus vitae ipsum.,jsaich3s@flickr.com,Jarvis Saich,277-291-3358,397-26-9249
