id,username,user_preferences,contact_number,user_bio,email_sensitive,full_name_sensitive,phone_number_sensitive,ssn_sensitive
698,ppowisjd,"[{},{},{},{},{}]",192-612-0011,"Curabitur gravida nisi at nibh. In hac habitasse platea dictumst. Aliquam augue quam, sollicitudin vitae, consectetuer eget, rutrum at, lorem.",ppowisjd@exblog.jp,Putnem Powis,213-638-6402,115-58-7367
699,voatsje,[{}],422-923-7314,Integer tincidunt ante vel ipsum. Praesent blandit lacinia erat. Vestibulum sed magna at nunc commodo placerat.,voatsje@wix.com,Virge Oats,344-265-1333,777-39-1293
700,cbrockiejf,"[{},{}]",682-823-0503,"Morbi vestibulum, velit id pretium iaculis, diam erat fermentum justo, nec condimentum neque sapien placerat ante. Nulla justo. Aliquam quis turpis eget elit sodales scelerisque.",cbrockiejf@gov.uk,Christoffer Brockie,728-929-5518,821-98-0186
701,ospriddlejg,"[{},{}]",331-923-8317,Nulla tempus.,ospriddlejg@indiatimes.com,Olive Spriddle,893-830-1513,857-61-0510
702,crennejh,"[{},{},{}]",728-251-5263,Vestibulum ac est lacinia nisi venenatis tristique.,crennejh@timesonline.co.uk,Chad Renne,511-770-8207,871-48-1039
703,lcushellyji,[],779-862-3189,"Integer non velit. Donec diam neque, vestibulum eget, vulputate ut, ultrices vel, augue.",lcushellyji@harvard.edu,Linus Cushelly,553-648-0215,117-86-5183
704,rlocksleyjj,"[{},{},{},{},{}]",984-893-8526,Fusce posuere felis sed lacus.,rlocksleyjj@fotki.com,Rosene Locksley,361-233-2323,454-93-3389
705,bdeljk,"[{},{},{},{}]",301-333-4144,"In est risus, auctor sed, tristique in, tempus sit amet, sem. Fusce consequat.",bdeljk@si.edu,Barbee Del Checolo,649-630-8996,671-12-8600
706,rkneejl,"[{},{},{},{}]",745-453-1883,Vestibulum rutrum rutrum neque.,rkneejl@aboutads.info,Rosalyn Knee,626-339-2574,784-26-5888
707,jolrenshawjm,"[{},{},{}]",343-867-4580,Nulla justo.,jolrenshawjm@godaddy.com,Jessy Olrenshaw,612-880-9142,395-43-3844
708,akarpeevjn,"[{},{},{}]",868-475-4400,Aliquam erat volutpat. In congue. Etiam justo.,akarpeevjn@shutterfly.com,Avivah Karpeev,438-253-5457,643-17-5910
709,bspinasjo,"[{},{}]",566-644-1190,"Integer non velit. Donec diam neque, vestibulum eget, vulputate ut, ultrices vel, augue. Vestibulum ante ipsum primis in faucibus orci luctus et ultrices posuere cubilia Curae; Donec pharetra, magna vestibulum aliquet ultrices, erat tortor sollicitudin mi, sit amet lobortis sapien sapien non mi.",bspinasjo@paginegialle.it,Benito Spinas,634-475-2258,530-04-4677
710,lcowleyjp,"[{},{},{},{}]",275-566-7718,Etiam vel augue. Vestibulum rutrum rutrum neque. Aenean auctor gravida sem.,lcowleyjp@hibu.com,Loni Cowley,969-169-5230,839-28-3719
711,hbreazealljq,[],547-692-5310,"Lorem ipsum dolor sit amet, consectetuer adipiscing elit.",hbreazealljq@berkeley.edu,Hugo Breazeall,444-166-8932,508-44-6088
712,ddemchenjr,"[{},{},{}]",707-491-7038,Praesent blandit. Nam nulla.,ddemchenjr@rediff.com,Dall Demchen,398-944-3944,358-65-7860
713,atargetterjs,[],394-156-2444,In hac habitasse platea dictumst. Etiam faucibus cursus urna. Ut tellus.,atargetterjs@lycos.com,Alvinia Targetter,112-344-7537,233-13-5704
714,acrocroftjt,[],984-351-9466,Quisque porta volutpat erat.,acrocroftjt@facebook.com,Andreana Crocroft,768-749-8142,115-11-0504
715,jfitzharrisju,[],674-651-5289,Nulla justo.,jfitzharrisju@usatoday.com,Jeanne Fitzharris,987-982-4605,477-38-1458
716,bmayhojv,"[{},{}]",157-724-0973,Maecenas ut massa quis augue luctus tincidunt. Nulla mollis molestie lorem.,bmayhojv@nydailynews.com,Berton Mayho,504-907-2121,510-69-3856
717,emckeveneyjw,[],429-859-8867,Pellentesque at nulla. Suspendisse potenti.,emckeveneyjw@facebook.com,Elysha McKeveney,664-282-9530,750-89-9785
718,wlangfieldjx,"[{},{},{},{},{}]",809-815-7534,Donec vitae nisi.,wlangfieldjx@toplist.cz,Willy Langfield,936-154-8290,372-84-6339
719,rmccurdyjy,"[{},{}]",531-115-8194,Nunc purus. Phasellus in felis. Donec semper sapien a libero.,rmccurdyjy@google.com,Rasia McCurdy,843-588-5005,132-59-2881
720,kmarchettijz,"[{},{},{},{}]",221-574-9569,"Fusce posuere felis sed lacus. Morbi sem mauris, laoreet ut, rhoncus aliquet, pulvinar sed, nisl. Nunc rhoncus dui vel sem.",kmarchettijz@cyberchimps.com,Killie Marchetti,530-551-3902,713-04-2564
721,rcarlucciok0,"[{},{}]",959-757-3095,Suspendisse accumsan tortor quis turpis. Sed ante. Vivamus tortor.,rcarlucciok0@nps.gov,Rodd Carluccio,260-843-2399,339-99-3691
722,smcgerrk1,"[{},{},{},{},{}]",855-640-5831,Donec quis orci eget orci vehicula condimentum.,smcgerrk1@elegantthemes.com,Stacee McGerr,133-518-7016,273-71-1037
723,cassardk2,"[{},{},{},{},{}]",142-128-6372,"Proin eu mi. Nulla ac enim. In tempor, turpis nec euismod scelerisque, quam turpis adipiscing lorem, vitae mattis nibh ligula nec sem.",cassardk2@craigslist.org,Carrissa Assard,225-383-2635,497-93-2764
724,scammackk3,"[{},{},{},{}]",872-775-5093,Maecenas tincidunt lacus at velit. Vivamus vel nulla eget eros elementum pellentesque. Quisque porta volutpat erat.,scammackk3@is.gd,Sarene Cammack,745-499-2943,506-02-0727
725,emazonowiczk4,"[{},{},{},{},{}]",986-693-6144,Aliquam erat volutpat. In congue.,emazonowiczk4@edublogs.org,Evvie Mazonowicz,814-146-4868,662-46-6979
726,mgaterk5,[],328-526-7272,Maecenas pulvinar lobortis est. Phasellus sit amet erat. Nulla tempus.,mgaterk5@salon.com,Monte Gater,661-684-9991,741-13-3196
727,pvaark6,"[{},{}]",211-941-4245,"Morbi sem mauris, laoreet ut, rhoncus aliquet, pulvinar sed, nisl. Nunc rhoncus dui vel sem.",pvaark6@yale.edu,Paola Vaar,391-731-8314,432-05-6175
728,wvittelk7,"[{},{},{}]",670-850-9798,Nullam molestie nibh in lectus.,wvittelk7@google.it,Willis Vittel,236-551-7853,269-17-0307
729,egoutk8,"[{},{},{}]",167-283-0334,"Integer aliquet, massa id lobortis convallis, tortor risus dapibus augue, vel accumsan tellus nisi eu orci. Mauris lacinia sapien quis libero. Nullam sit amet turpis elementum ligula vehicula consequat.",egoutk8@oakley.com,Emery Gout,974-613-7702,839-95-8852
730,udymidowskik9,"[{},{},{},{}]",595-946-3325,Nulla facilisi. Cras non velit nec nisi vulputate nonummy.,udymidowskik9@hibu.com,Ursulina Dymidowski,895-551-5805,394-55-7443
731,ejeaninka,[{}],506-356-2367,Donec semper sapien a libero.,ejeaninka@photobucket.com,Elane Jeanin,319-819-9466,399-44-5674
732,dbechleykb,[],985-710-4401,Donec dapibus.,dbechleykb@woothemes.com,Darya Bechley,513-262-1794,626-93-8760
733,boflannerykc,"[{},{}]",667-171-6266,Aenean auctor gravida sem. Praesent id massa id nisl venenatis lacinia. Aenean sit amet justo.,boflannerykc@macromedia.com,Brittne O'Flannery,125-373-1386,809-90-2516
734,bsansburykd,[{}],922-798-2312,Duis mattis egestas metus.,bsansburykd@t-online.de,Barbara-anne Sansbury,150-950-7802,361-58-8014
735,uvasichevke,"[{},{},{},{},{}]",163-421-3009,Nulla ac enim.,uvasichevke@de.vu,Ulrikaumeko Vasichev,602-171-6758,494-20-4286
736,khammellkf,"[{},{}]",684-344-5117,Nam dui.,khammellkf@squidoo.com,Kacey Hammell,107-971-9683,731-55-6292
737,mlenoxkg,"[{},{}]",939-456-3684,Praesent id massa id nisl venenatis lacinia. Aenean sit amet justo. Morbi ut odio.,mlenoxkg@mapy.cz,Moselle Lenox,621-120-4406,808-68-0607
738,fgirkinskh,"[{},{},{},{}]",694-273-4964,Integer ac leo.,fgirkinskh@acquirethisname.com,Faustine Girkins,571-648-8399,654-91-7487
739,spollinski,"[{},{}]",236-885-0939,"Aenean fermentum. Donec ut mauris eget massa tempor convallis. Nulla neque libero, convallis eget, eleifend luctus, ultricies eu, nibh.",spollinski@ucla.edu,Stoddard Pollins,655-379-2489,785-86-3739
740,cbengekj,"[{},{}]",350-932-7601,Proin at turpis a pede posuere nonummy.,cbengekj@tinypic.com,Candide Benge,628-259-9669,845-09-3169
741,gjurykk,"[{},{},{},{},{}]",438-259-6722,Proin interdum mauris non ligula pellentesque ultrices. Phasellus id sapien in sapien iaculis congue.,gjurykk@hhs.gov,Gearard Jury,477-805-2224,710-30-2795
742,ekittelkl,[],752-759-5748,"Nam dui. Proin leo odio, porttitor id, consequat in, consequat ut, nulla.",ekittelkl@amazon.co.jp,Elaina Kittel,748-417-9028,583-20-5022
743,ehucklekm,[{}],805-695-6437,"Maecenas rhoncus aliquam lacus. Morbi quis tortor id nulla ultrices aliquet. Maecenas leo odio, condimentum id, luctus nec, molestie sed, justo.",ehucklekm@elpais.com,Erminia Huckle,610-551-4899,636-53-1027
744,jdebookn,[{}],376-134-3663,Vivamus vel nulla eget eros elementum pellentesque.,jdebookn@blogtalkradio.com,Jerrilee Deboo,346-262-8654,642-04-1377
745,kguirauko,"[{},{},{},{},{}]",971-124-4359,"Maecenas leo odio, condimentum id, luctus nec, molestie sed, justo. Pellentesque viverra pede ac diam. Cras pellentesque volutpat dui.",kguirauko@timesonline.co.uk,Kellby Guirau,926-560-1413,122-84-5849
746,tshererkp,"[{},{},{}]",560-118-7132,Nullam molestie nibh in lectus. Pellentesque at nulla. Suspendisse potenti.,tshererkp@disqus.com,Torrie Sherer,829-546-6179,893-13-6606
747,equickendenkq,"[{},{},{},{},{}]",555-288-5960,Pellentesque at nulla. Suspendisse potenti.,equickendenkq@wikipedia.org,Evin Quickenden,119-159-2561,351-34-1428
748,hlansdownkr,"[{},{}]",158-800-8214,"Morbi vel lectus in quam fringilla rhoncus. Mauris enim leo, rhoncus sed, vestibulum sit amet, cursus id, turpis. Integer aliquet, massa id lobortis convallis, tortor risus dapibus augue, vel accumsan tellus nisi eu orci.",hlansdownkr@yahoo.co.jp,Helenka Lansdown,441-950-5757,811-53-5024
749,bsucreks,[{}],986-488-0574,Aliquam erat volutpat. In congue.,bsucreks@sourceforge.net,Bruce Sucre,648-610-2039,764-18-9662
750,wwildkt,[],688-315-2403,Curabitur gravida nisi at nibh. In hac habitasse platea dictumst.,wwildkt@gnu.org,Wayne Wild,715-734-4230,466-08-9869
751,cgoslinku,[{}],596-657-9890,"Mauris ullamcorper purus sit amet nulla. Quisque arcu libero, rutrum ac, lobortis vel, dapibus at, diam.",cgoslinku@blogspot.com,Chrysa Goslin,726-349-9589,248-71-9681
752,padnetkv,"[{},{},{}]",949-800-4716,Quisque id justo sit amet sapien dignissim vestibulum.,padnetkv@geocities.jp,Pasquale Adnet,366-970-1971,383-81-6225
753,dcamollikw,"[{},{},{}]",411-333-1927,"In tempor, turpis nec euismod scelerisque, quam turpis adipiscing lorem, vitae mattis nibh ligula nec sem.",dcamollikw@irs.gov,Derry Camolli,767-343-4813,800-92-1303
754,slanekx,"[{},{},{},{}]",513-413-5460,Sed vel enim sit amet nunc viverra dapibus. Nulla suscipit ligula in lacus.,slanekx@desdev.cn,Sanford Lane,304-548-5610,249-12-7454
755,epeareky,[],897-738-7862,Aliquam quis turpis eget elit sodales scelerisque. Mauris sit amet eros. Suspendisse accumsan tortor quis turpis.,epeareky@noaa.gov,Erin Peare,608-692-1084,209-23-2453
756,kmcmurtyrkz,[],262-437-4262,"Mauris enim leo, rhoncus sed, vestibulum sit amet, cursus id, turpis. Integer aliquet, massa id lobortis convallis, tortor risus dapibus augue, vel accumsan tellus nisi eu orci.",kmcmurtyrkz@friendfeed.com,Karlene McMurtyr,243-995-4310,445-29-3819
757,cpinnigerl0,"[{},{}]",106-640-5021,Fusce consequat.,cpinnigerl0@hao123.com,Cad Pinniger,721-907-9066,511-20-6774
758,acamachol1,"[{},{}]",420-814-9922,"Lorem ipsum dolor sit amet, consectetuer adipiscing elit.",acamachol1@tumblr.com,Andre Camacho,514-359-3510,394-78-6056
759,fbonifacel2,"[{},{},{},{},{}]",890-959-8415,"Quisque erat eros, viverra eget, congue eget, semper rutrum, nulla. Nunc purus. Phasellus in felis.",fbonifacel2@wiley.com,Florri Boniface,931-224-5315,749-74-1229
760,gbodel3,[{}],325-854-8984,Nulla tellus.,gbodel3@acquirethisname.com,Gaylor Bode,778-223-6672,321-14-0050
761,roverburyl4,"[{},{},{},{}]",595-201-9240,Pellentesque viverra pede ac diam.,roverburyl4@marketwatch.com,Rick Overbury,644-889-0922,715-52-8321
762,cburcombel5,"[{},{},{}]",551-239-7122,"Praesent lectus. Vestibulum quam sapien, varius ut, blandit non, interdum in, ante. Vestibulum ante ipsum primis in faucibus orci luctus et ultrices posuere cubilia Curae; Duis faucibus accumsan odio.",cburcombel5@tiny.cc,Cthrine Burcombe,370-254-8549,728-03-0536
763,ycapenerl6,"[{},{}]",282-443-3356,Maecenas rhoncus aliquam lacus.,ycapenerl6@altervista.org,Yorke Capener,198-746-4646,104-64-1501
764,pegglestonel7,"[{},{},{}]",143-895-3518,Nunc purus.,pegglestonel7@craigslist.org,Parsifal Egglestone,939-231-0157,310-68-9172
765,oarlidgel8,"[{},{},{},{}]",502-655-1096,Nullam varius. Nulla facilisi.,oarlidgel8@so-net.ne.jp,Orel Arlidge,145-663-0898,826-21-4759
766,tstovinl9,"[{},{}]",931-679-6543,Maecenas ut massa quis augue luctus tincidunt. Nulla mollis molestie lorem. Quisque ut erat.,tstovinl9@walmart.com,Tarah Stovin,396-593-9880,206-09-0325
767,nenglishbyla,"[{},{},{},{}]",710-651-2945,"Praesent lectus. Vestibulum quam sapien, varius ut, blandit non, interdum in, ante. Vestibulum ante ipsum primis in faucibus orci luctus et ultrices posuere cubilia Curae; Duis faucibus accumsan odio.",nenglishbyla@fema.gov,Nickola Englishby,408-659-2435,506-57-7272
768,sheinonenlb,"[{},{},{}]",761-657-3071,"Morbi vestibulum, velit id pretium iaculis, diam erat fermentum justo, nec condimentum neque sapien placerat ante. Nulla justo.",sheinonenlb@paginegialle.it,Sergent Heinonen,428-699-2538,437-75-6052
769,cgladdishlc,"[{},{},{},{},{}]",487-454-9936,Aliquam non mauris. Morbi non lectus.,cgladdishlc@answers.com,Cherri Gladdish,547-348-8104,890-97-9000
770,mlynessld,"[{},{},{}]",859-827-5739,"Maecenas leo odio, condimentum id, luctus nec, molestie sed, justo. Pellentesque viverra pede ac diam. Cras pellentesque volutpat dui.",mlynessld@dropbox.com,Melva Lyness,836-141-9668,868-02-8103
771,mchinnickle,[{}],198-889-7916,Sed vel enim sit amet nunc viverra dapibus.,mchinnickle@vistaprint.com,Merrick Chinnick,317-730-8048,803-80-6211
772,bbatsonlf,"[{},{},{}]",530-541-2107,"Nam nulla. Integer pede justo, lacinia eget, tincidunt eget, tempus vel, pede. Morbi porttitor lorem id ligula.",bbatsonlf@sphinn.com,Bern Batson,608-903-5912,324-02-4429
773,cmeddemmenlg,"[{},{},{},{},{}]",305-105-5570,Praesent blandit.,cmeddemmenlg@dailymail.co.uk,Carine Meddemmen,639-516-9276,282-20-1611
774,abriertonlh,"[{},{},{}]",195-874-2832,In hac habitasse platea dictumst.,abriertonlh@devhub.com,Aubry Brierton,812-111-3487,569-03-3632
775,oboothebieli,[{}],884-679-6835,Nulla tellus.,oboothebieli@chronoengine.com,Odille Boothebie,668-336-1101,608-94-2577
776,eprandinilj,[],560-853-0919,"Donec quis orci eget orci vehicula condimentum. Curabitur in libero ut massa volutpat convallis. Morbi odio odio, elementum eu, interdum eu, tincidunt in, leo.",eprandinilj@twitpic.com,Elinore Prandini,543-752-5112,371-05-1854
777,lcardinalelk,"[{},{}]",389-669-4445,Pellentesque at nulla.,lcardinalelk@mozilla.org,Lorenzo Cardinale,981-307-9865,865-11-5149
778,tathowell,"[{},{}]",141-205-7980,Morbi a ipsum. Integer a nibh.,tathowell@liveinternet.ru,Tadio Athowe,856-700-5370,186-93-7543
779,nstookeslm,"[{},{},{}]",870-218-9377,In eleifend quam a odio. In hac habitasse platea dictumst.,nstookeslm@npr.org,Nikola Stookes,649-465-4585,256-38-7946
780,lgheeraertln,[],267-533-0658,"Lorem ipsum dolor sit amet, consectetuer adipiscing elit. Proin interdum mauris non ligula pellentesque ultrices.",lgheeraertln@dedecms.com,Lalo Gheeraert,709-335-1026,201-15-8325
781,bdelo,"[{},{},{}]",590-113-7481,"Morbi quis tortor id nulla ultrices aliquet. Maecenas leo odio, condimentum id, luctus nec, molestie sed, justo.",bdelo@reuters.com,Brnaba De Vuyst,771-460-1106,894-68-6764
782,hjenkinsonlp,[{}],254-172-1165,Mauris lacinia sapien quis libero. Nullam sit amet turpis elementum ligula vehicula consequat.,hjenkinsonlp@google.de,Henriette Jenkinson,693-640-1034,668-92-1974
783,tmcsherrylq,"[{},{},{},{}]",437-950-0172,"In est risus, auctor sed, tristique in, tempus sit amet, sem.",tmcsherrylq@adobe.com,Theobald McSherry,225-389-4772,579-85-6401
784,tcropperlr,"[{},{},{},{}]",522-330-8535,Vestibulum ante ipsum primis in faucibus orci luctus et ultrices posuere cubilia Curae; Duis faucibus accumsan odio. Curabitur convallis. Duis consequat dui nec nisi volutpat eleifend.,tcropperlr@netvibes.com,Trip Cropper,684-666-3234,787-32-0126
785,dnovikls,[],923-171-6237,Donec quis orci eget orci vehicula condimentum.,dnovikls@rediff.com,Don Novik,504-592-8818,629-18-9743
786,pshoebottomlt,"[{},{}]",804-908-6724,"Morbi sem mauris, laoreet ut, rhoncus aliquet, pulvinar sed, nisl. Nunc rhoncus dui vel sem. Sed sagittis.",pshoebottomlt@about.me,Pia Shoebottom,997-508-2772,628-35-3930
787,ntellenbroklu,"[{},{},{}]",724-714-3466,Nulla nisl. Nunc nisl.,ntellenbroklu@yale.edu,Natalie Tellenbrok,177-839-6007,874-74-3083
788,edustlv,"[{},{}]",652-491-6329,Nulla mollis molestie lorem. Quisque ut erat. Curabitur gravida nisi at nibh.,edustlv@bravesites.com,Elianora Dust,958-908-8895,468-64-5414
789,rhowlinglw,[],514-438-0533,Maecenas rhoncus aliquam lacus. Morbi quis tortor id nulla ultrices aliquet.,rhowlinglw@answers.com,Roseline Howling,415-817-4588,782-83-8875
790,rclemoeslx,"[{},{}]",242-436-6043,Aenean lectus. Pellentesque eget nunc.,rclemoeslx@comsenz.com,Rhetta Clemoes,192-858-5625,448-31-0523
791,aharroply,"[{},{},{}]",333-200-9614,Donec dapibus. Duis at velit eu est congue elementum. In hac habitasse platea dictumst.,aharroply@spotify.com,Adolphe Harrop,658-326-2892,888-51-8874
792,scalelz,"[{},{}]",131-214-0550,Vestibulum ante ipsum primis in faucibus orci luctus et ultrices posuere cubilia Curae; Duis faucibus accumsan odio. Curabitur convallis.,scalelz@xinhuanet.com,Sean Cale,382-702-7621,795-60-9712
793,aserrierm0,"[{},{},{},{}]",551-122-1056,Mauris sit amet eros.,aserrierm0@ucoz.com,Angelica Serrier,331-630-5021,388-65-7880
794,govittsm1,"[{},{},{},{}]",779-617-1128,"Duis bibendum, felis sed interdum venenatis, turpis enim blandit mi, in porttitor pede justo eu massa. Donec dapibus.",govittsm1@addtoany.com,Gladi Ovitts,148-257-9450,114-48-0482
795,pgascoignem2,"[{},{},{},{},{}]",898-939-0000,Curabitur at ipsum ac tellus semper interdum. Mauris ullamcorper purus sit amet nulla.,pgascoignem2@howstuffworks.com,Pansie Gascoigne,917-994-6254,185-09-6694
796,tallsebrookm3,[{}],458-287-2521,"Fusce posuere felis sed lacus. Morbi sem mauris, laoreet ut, rhoncus aliquet, pulvinar sed, nisl.",tallsebrookm3@macromedia.com,Tory Allsebrook,604-821-7092,196-33-0145
797,sthunnerclefm4,"[{},{}]",450-572-5229,Nullam porttitor lacus at turpis. Donec posuere metus vitae ipsum.,sthunnerclefm4@nature.com,Silvan Thunnerclef,293-254-9172,186-22-8249
798,pcantrellm5,"[{},{},{}]",704-457-4116,Nunc rhoncus dui vel sem. Sed sagittis.,pcantrellm5@arstechnica.com,Phyllis Cantrell,121-768-1256,234-34-1930
799,gfooterm6,"[{},{}]",371-960-6015,"Phasellus id sapien in sapien iaculis congue. Vivamus metus arcu, adipiscing molestie, hendrerit at, vulputate vitae, nisl.",gfooterm6@usatoday.com,Gerry Footer,959-647-9125,863-12-1376
800,aderdesm7,[],375-617-3925,"Quisque id justo sit amet sapien dignissim vestibulum. Vestibulum ante ipsum primis in faucibus orci luctus et ultrices posuere cubilia Curae; Nulla dapibus dolor vel est. Donec odio justo, sollicitudin ut, suscipit a, feugiat et, eros.",aderdesm7@si.edu,Anni Derdes,629-927-5032,381-44-2486
801,mwapplingtonm8,"[{},{}]",460-399-1554,Aliquam quis turpis eget elit sodales scelerisque. Mauris sit amet eros.,mwapplingtonm8@drupal.org,Mavis Wapplington,700-869-6887,318-68-8428
802,tstrangwardm9,[{}],453-462-7601,Suspendisse potenti. In eleifend quam a odio.,tstrangwardm9@mlb.com,Toby Strangward,504-997-2619,463-21-2623
803,hohearnma,[{}],211-121-1464,Donec semper sapien a libero. Nam dui.,hohearnma@go.com,Hatty O'Hearn,353-156-3417,724-71-8060
804,ecysonmb,"[{},{},{},{}]",917-915-8796,Aenean sit amet justo. Morbi ut odio.,ecysonmb@themeforest.net,Evaleen Cyson,900-273-6291,508-99-5035
805,ibaguleymc,"[{},{}]",870-451-8724,"In hac habitasse platea dictumst. Aliquam augue quam, sollicitudin vitae, consectetuer eget, rutrum at, lorem.",ibaguleymc@google.co.uk,Irene Baguley,623-478-9974,747-36-5022
806,bstanlickmd,[{}],160-319-3030,"Proin risus. Praesent lectus. Vestibulum quam sapien, varius ut, blandit non, interdum in, ante.",bstanlickmd@github.io,Brett Stanlick,456-583-7110,148-96-6307
807,rsergantme,"[{},{},{},{},{}]",638-638-7357,Nullam porttitor lacus at turpis.,rsergantme@blogtalkradio.com,Rinaldo Sergant,153-954-4480,293-71-6704
808,bgavaranmf,"[{},{}]",528-850-2348,Nulla ut erat id mauris vulputate elementum. Nullam varius.,bgavaranmf@time.com,Berty Gavaran,744-454-9692,280-36-7423
809,aburrelmg,"[{},{}]",645-449-8681,Aenean fermentum. Donec ut mauris eget massa tempor convallis.,aburrelmg@spotify.com,Aubert Burrel,466-729-4666,512-61-2910
810,wconisbeemh,"[{},{},{},{},{}]",794-347-9726,Cras non velit nec nisi vulputate nonummy.,wconisbeemh@umich.edu,Winny Conisbee,671-572-0242,714-72-6753
811,bbirdseymi,[],480-975-4033,Maecenas rhoncus aliquam lacus. Morbi quis tortor id nulla ultrices aliquet.,bbirdseymi@pinterest.com,Bill Birdsey,174-547-7052,248-93-2913
812,spenddrethmj,[{}],770-922-4006,Aenean lectus.,spenddrethmj@va.gov,Sabra Penddreth,125-986-9149,415-37-8999
813,cjervoismk,"[{},{}]",441-322-4678,"Fusce lacus purus, aliquet at, feugiat non, pretium quis, lectus. Suspendisse potenti.",cjervoismk@who.int,Corabel Jervois,137-311-5032,682-52-1870
814,ashapiroml,"[{},{},{},{}]",619-820-1512,"Integer aliquet, massa id lobortis convallis, tortor risus dapibus augue, vel accumsan tellus nisi eu orci. Mauris lacinia sapien quis libero.",ashapiroml@huffingtonpost.com,Avis Shapiro,789-460-3936,781-78-8869
815,fwitteymm,[{}],884-883-1857,Nulla justo. Aliquam quis turpis eget elit sodales scelerisque. Mauris sit amet eros.,fwitteymm@java.com,Forrester Wittey,165-431-4682,589-94-2427
816,bbrixeymn,"[{},{}]",618-973-8448,Vestibulum ante ipsum primis in faucibus orci luctus et ultrices posuere cubilia Curae; Mauris viverra diam vitae quam. Suspendisse potenti.,bbrixeymn@army.mil,Bettina Brixey,647-893-8105,487-33-5265
817,erisdallmo,[],420-297-5971,Nunc rhoncus dui vel sem.,erisdallmo@ca.gov,Eleanora Risdall,495-909-0980,207-48-6436
818,dgiggmp,"[{},{},{},{},{}]",579-813-6557,"Nulla ac enim. In tempor, turpis nec euismod scelerisque, quam turpis adipiscing lorem, vitae mattis nibh ligula nec sem. Duis aliquam convallis nunc.",dgiggmp@cornell.edu,Danit Gigg,723-554-8651,795-54-5266
819,bcushworthmq,"[{},{},{},{}]",316-657-2051,Aenean fermentum. Donec ut mauris eget massa tempor convallis.,bcushworthmq@opera.com,Benoit Cushworth,303-766-6598,130-92-7751
820,sitzakmr,"[{},{},{}]",103-497-7292,"Morbi vel lectus in quam fringilla rhoncus. Mauris enim leo, rhoncus sed, vestibulum sit amet, cursus id, turpis.",sitzakmr@ca.gov,Saunder Itzak,399-608-6148,849-34-2206
821,sdeschleinms,"[{},{}]",277-413-4300,In congue. Etiam justo.,sdeschleinms@domainmarket.com,Samantha Deschlein,975-510-2184,755-73-9362
822,fwybronmt,"[{},{},{},{},{}]",231-767-1291,Vestibulum ante ipsum primis in faucibus orci luctus et ultrices posuere cubilia Curae; Duis faucibus accumsan odio. Curabitur convallis.,fwybronmt@tripod.com,Farica Wybron,991-751-9128,199-58-7609
823,fwroughtmu,"[{},{}]",186-547-8446,"Donec quis orci eget orci vehicula condimentum. Curabitur in libero ut massa volutpat convallis. Morbi odio odio, elementum eu, interdum eu, tincidunt in, leo.",fwroughtmu@instagram.com,Fairfax Wrought,162-256-8931,394-49-2983
824,cdebnammv,[],737-270-2538,Quisque id justo sit amet sapien dignissim vestibulum.,cdebnammv@about.com,Charmaine Debnam,463-935-4181,877-93-7200
825,estellinomw,"[{},{},{},{}]",534-197-6955,Proin interdum mauris non ligula pellentesque ultrices.,estellinomw@examiner.com,Erroll Stellino,437-530-9582,384-97-6672
826,egannicleffmx,"[{},{},{},{},{}]",601-886-5959,Nullam molestie nibh in lectus. Pellentesque at nulla. Suspendisse potenti.,egannicleffmx@wired.com,Eleen Gannicleff,661-472-2610,295-42-3494
827,haggissmy,[{}],469-626-5260,Phasellus sit amet erat. Nulla tempus. Vivamus in felis eu sapien cursus vestibulum.,haggissmy@instagram.com,Hulda Aggiss,636-663-4866,555-46-1201
828,nbyshmz,"[{},{},{}]",628-779-1480,Duis mattis egestas metus. Aenean fermentum. Donec ut mauris eget massa tempor convallis.,nbyshmz@google.com,Nara Bysh,329-917-6237,857-01-8769
829,astennetn0,[{}],655-943-4164,"Donec diam neque, vestibulum eget, vulputate ut, ultrices vel, augue. Vestibulum ante ipsum primis in faucibus orci luctus et ultrices posuere cubilia Curae; Donec pharetra, magna vestibulum aliquet ultrices, erat tortor sollicitudin mi, sit amet lobortis sapien sapien non mi.",astennetn0@4shared.com,Anthe Stennet,781-889-0021,408-81-9379
830,bfassann1,[{}],748-555-3852,Integer ac leo.,bfassann1@nasa.gov,Beaufort Fassan,989-414-9065,333-13-3155
831,cbleacklyn2,[],616-732-1674,"In hac habitasse platea dictumst. Aliquam augue quam, sollicitudin vitae, consectetuer eget, rutrum at, lorem.",cbleacklyn2@liveinternet.ru,Constancy Bleackly,669-638-7838,113-56-4177
832,ewattn3,"[{},{},{},{},{}]",696-537-1691,Integer non velit.,ewattn3@slashdot.org,Ethelind Watt,844-949-5765,823-66-1298
833,lplayfootn4,[],903-380-1858,Donec posuere metus vitae ipsum. Aliquam non mauris. Morbi non lectus.,lplayfootn4@delicious.com,Livvy Playfoot,169-138-2726,675-94-4181
834,pmacdavittn5,"[{},{}]",864-288-5574,"Pellentesque viverra pede ac diam. Cras pellentesque volutpat dui. Maecenas tristique, est et tempus semper, est quam pharetra magna, ac consequat metus sapien ut nunc.",pmacdavittn5@facebook.com,Prudy MacDavitt,644-470-2315,319-84-7289
835,ajovanovicn6,"[{},{}]",524-837-7444,Quisque porta volutpat erat.,ajovanovicn6@bluehost.com,Aurilia Jovanovic,479-708-5769,473-03-5113
836,eclinnickn7,"[{},{},{},{},{}]",358-765-4406,"Morbi sem mauris, laoreet ut, rhoncus aliquet, pulvinar sed, nisl. Nunc rhoncus dui vel sem. Sed sagittis.",eclinnickn7@4shared.com,Edmon Clinnick,930-242-2045,781-05-5451
837,gfeeneyn8,"[{},{},{}]",372-741-7701,"Morbi ut odio. Cras mi pede, malesuada in, imperdiet et, commodo vulputate, justo. In blandit ultrices enim.",gfeeneyn8@reddit.com,Gypsy Feeney,872-338-5679,483-60-5319
838,chazlegroven9,"[{},{},{},{},{}]",398-723-6426,"Duis ac nibh. Fusce lacus purus, aliquet at, feugiat non, pretium quis, lectus. Suspendisse potenti.",chazlegroven9@sina.com.cn,Courtnay Hazlegrove,813-793-8968,447-41-8755
